"176","Gamage","Adaptation, translation and reliability of the Australian ‘Juniors Enjoying Cricket Safely’ injury risk perception 
questionnaire for Sri Lanka",2018,"the aim of this study was to cross-culturally adapt, translate and test the reliability of an australian-developed questionnaire for the sri lankan context.",NA,"longitudinal","risk",NA,NA,NA,NA,"scale",NA,NA,NA,NA,NA,NA,NA,NA,NA,"10 items",NA,NA,NA,NA,"2",NA,NA,NA,NA,"single",NA,NA,NA,NA,NA,NA,NA,NA,NA,NA,NA,NA,NA,NA,NA,NA,NA,NA,NA,NA,NA,NA,NA,NA,"health; other: sport/injury","yes",NA,NA,NA,NA,"test-retest",NA,NA,NA,NA,"0.22 to 0.6",NA,NA,NA,NA,NA,NA,NA,NA,NA,NA,NA,NA,NA,NA,NA,NA,NA,NA,NA,"2 weeks",NA,NA,NA,NA,NA,NA,NA,NA,NA,NA,NA,NA,NA,NA,"laypeople",NA,NA,NA,NA,"cricket players",NA,NA,NA,NA,"adolescents",NA,NA,NA,NA,"sri lanka",NA,NA,NA,NA,54,NA,NA,NA,NA,0,NA,NA,NA,NA,NA,NA,NA,NA,NA,NA,NA,NA,NA,NA,11,NA,NA,NA,NA,15,NA,NA,NA,NA
"177","Kohler","Social Networks and HIV/AIDS Risk Perceptions",2007,"we focus in this article on learning and decision-making about aids in the context of high uncertainty about the disease and appropriate behavioral responses. we argue that social interactions are important for both.","kenyan diffusion and ideational change project 
(kdicp) and the malawi diffusion and ideational change project (mdicp) --- is this panel????","longitudinal","risk",NA,NA,NA,NA,"single item",NA,NA,NA,NA,"4-point likert scale",NA,NA,NA,NA,"the specific question 
regarding the risk perceptions of the network partners was phrased as “how worried is name of network partner about getting aids?,”",NA,NA,NA,NA,"3",NA,NA,NA,NA,"single",NA,NA,NA,NA,NA,NA,NA,NA,NA,NA,NA,NA,NA,NA,NA,NA,NA,NA,NA,NA,NA,NA,NA,NA,"health; other: hiv/aids","yes",NA,NA,NA,NA,"temporal trend",NA,NA,NA,NA,NA,NA,NA,NA,NA,"significant",NA,NA,NA,NA,NA,NA,NA,NA,NA,"increases in respondents’ risk perceptions on the number of social network partners 
with high, moderate, and low risk perceptions",NA,NA,NA,NA,NA,NA,NA,NA,NA,"2 years",NA,NA,NA,NA,NA,NA,NA,NA,NA,"laypeople",NA,NA,NA,NA,NA,NA,NA,NA,NA,"adults",NA,NA,NA,NA,"kenya and malawi",NA,NA,NA,NA,NA,NA,NA,NA,NA,NA,NA,NA,NA,NA,NA,NA,NA,NA,NA,NA,NA,NA,NA,NA,NA,NA,NA,NA,NA,NA,NA,NA,NA,NA
"178","Anderson-Berry","Community Vulnerability to Tropical Cyclones: Cairns, 1996-2000",2003,"the aim of the study was to examine the vulnerability of the cairns community in australia to the coastal impact of tropical cyclones and associated hazards",NA,"longitudinal","risk",NA,NA,NA,NA,"scale",NA,NA,NA,NA,"likert scale 1-6",NA,NA,NA,NA,NA,NA,NA,NA,NA,"3",NA,NA,NA,NA,"single",NA,NA,NA,NA,"tropical cyclones",NA,NA,NA,NA,"2",NA,NA,NA,NA,NA,NA,NA,NA,NA,NA,NA,NA,NA,NA,"natural catastrophe; other: cyclones","no",NA,NA,NA,NA,NA,NA,NA,NA,NA,NA,NA,NA,NA,NA,NA,NA,NA,NA,NA,NA,NA,NA,NA,NA,NA,NA,NA,NA,NA,NA,NA,NA,NA,NA,NA,NA,NA,NA,NA,NA,NA,NA,NA,NA,NA,NA,NA,NA,NA,NA,NA,NA,NA,NA,NA,NA,NA,NA,NA,NA,NA,NA,NA,NA,NA,NA,NA,NA,NA,NA,NA,NA,NA,NA,NA,NA,NA,NA,NA,NA,NA,NA,NA,NA,NA,NA,NA,NA,NA,NA,NA,NA,NA,NA
"179","Janssen","Measuring risk perceptions of skin cancer: Reliability and validity of different operationalizations",2011,"this study investigated the reliability and predictive validity of different risk perception operationalizations related to skin cancer and sunscreen use in order to explain the inconsistent findings in literature regarding
the relationship between risk perceptions and (cancer related) behaviours.",NA,"longitudinal","risk","risk",NA,NA,NA,"scale","scale",NA,NA,NA,NA,NA,NA,NA,NA,"risk perception measured via perceived likelihood and perceived severity. perceived likelihood split into different components: absolute risk, comparative risk, direct/indirect, unconditional/conditional, cognitive/affective. perceived severity split into absolute/comparative, physical/social/psychological.","14 items",NA,NA,NA,"2",2,NA,NA,NA,"study 1","study 2",NA,NA,NA,NA,"ski trip",NA,NA,NA,NA,1,NA,NA,NA,NA,NA,NA,NA,NA,NA,NA,NA,NA,NA,"cancer ; other: sun protection","yes","no",NA,NA,NA,"test-retest",NA,NA,NA,NA,"(r/icc) ranged between .51 and .82 for the likelihood measures and between .58 and .75
for the severity measures",NA,NA,NA,NA,NA,NA,NA,NA,NA,NA,NA,NA,NA,NA,NA,NA,NA,NA,NA,"18 days",NA,NA,NA,NA,NA,NA,NA,NA,NA,NA,NA,NA,NA,NA,"laypeople",NA,NA,NA,NA,"students",NA,NA,NA,NA,"adults",NA,NA,NA,NA,"the netherlands",NA,NA,NA,NA,175,NA,NA,NA,NA,0.49,NA,NA,NA,NA,"22",NA,NA,NA,NA,NA,NA,NA,NA,NA,NA,NA,NA,NA,NA,NA,NA,NA,NA,NA
"180","Heath","Risk Communication Emergency Response Preparedness: Contextual Assessment of the Protective Action Decision Model",2018,"this article investigates the predictive ability of the protective action decision model (padm), which links environmental and social cues, predecision processes (attention, exposure, and comprehension), and risk decision perceptions (threat, alternative protective actions, and stakeholder norms) with protective action decision making.",NA,"longitudinal","threat",NA,NA,NA,NA,"scale",NA,NA,NA,NA,"4-point likert scale",NA,NA,NA,NA,"9 items: items include chemical leaks from pipeline ruptures, train derailments, tanker truck overturns, and plant explosions, as weak as dangers and harms from odors, emissions, and flares.",NA,NA,NA,NA,"4",NA,NA,NA,NA,"single",NA,NA,NA,NA,NA,NA,NA,NA,NA,NA,NA,NA,NA,NA,NA,NA,NA,NA,NA,NA,NA,NA,NA,NA,"other: risk communication and decision-making during emergencies","no",NA,NA,NA,NA,NA,NA,NA,NA,NA,NA,NA,NA,NA,NA,NA,NA,NA,NA,NA,NA,NA,NA,NA,NA,NA,NA,NA,NA,NA,NA,NA,NA,NA,NA,NA,NA,NA,NA,NA,NA,NA,NA,NA,NA,NA,NA,NA,NA,NA,NA,NA,NA,NA,NA,NA,NA,NA,NA,NA,NA,NA,NA,NA,NA,NA,NA,NA,NA,NA,NA,NA,NA,NA,NA,NA,NA,NA,NA,NA,NA,NA,NA,NA,NA,NA,NA,NA,NA,NA,NA,NA,NA,NA,NA
"181","Wong","Seeing is believing: examining self-efficacy and trait hope as moderators of youths’ positive risk-taking intention",2021,"we examine how positive risk-taking videos influence risk perception and risk-taking intention through vicarious learning. gender and cross-cultural differences are also assessed to explore varying outcomes in risk perception and risk-taking intention",NA,"longitudinal","risk",NA,NA,NA,NA,"scale",NA,NA,NA,NA,"4-point likert",NA,NA,NA,NA,"22 items",NA,NA,NA,NA,"2",NA,NA,NA,NA,"single",NA,NA,NA,NA,"participants were assigned to different conditions based on their situation (prosocial, recreational, health, control (no video)). each group watched a specific video related to their condition. positive risk taking contexts were employed as well.",NA,NA,NA,NA,"1",NA,NA,NA,NA,NA,NA,NA,NA,NA,NA,NA,NA,NA,NA,"health","yes",NA,NA,NA,NA,"mean difference",NA,NA,NA,NA,NA,NA,NA,NA,NA,NA,NA,NA,NA,NA,"significant",NA,NA,NA,NA,"t1-t2; difference baseline and post-video assessment was marginal.",NA,NA,NA,NA,NA,NA,NA,NA,NA,NA,NA,NA,NA,NA,"2 weeks",NA,NA,NA,NA,"laypeople",NA,NA,NA,NA,NA,NA,NA,NA,NA,"adults",NA,NA,NA,NA,"usa",NA,NA,NA,NA,646,NA,NA,NA,NA,0.81,NA,NA,NA,NA,NA,NA,NA,NA,NA,NA,NA,NA,NA,NA,18,NA,NA,NA,NA,28,NA,NA,NA,NA
"182","Peleg","Illness perceptions or recurrence risk perceptions: What comes first? A longitudinal cross-lagged examination among cardiac patients",2016,"this study aimed to assess the direction of relationships between illness and
recurrence risk perceptions over time, among cardiac patients",NA,"longitudinal","risk",NA,NA,NA,NA,"single item",NA,NA,NA,NA,"7-point likert scale",NA,NA,NA,NA,"perceived recurrence risk was measured both at t1 and t2 by the question: ‘what
is the likelihood that at some point in your life you’ll experience a cardiac event again?’",NA,NA,NA,NA,"2",NA,NA,NA,NA,"single",NA,NA,NA,NA,NA,NA,NA,NA,NA,NA,NA,NA,NA,NA,NA,NA,NA,NA,NA,NA,NA,NA,NA,NA,"health; other: coronary angioplasty","yes",NA,NA,NA,NA,"mean difference",NA,NA,NA,NA,NA,NA,NA,NA,NA,NA,NA,NA,NA,NA,"not significant",NA,NA,NA,NA,"t1-t2",NA,NA,NA,NA,NA,NA,NA,NA,NA,NA,NA,NA,NA,NA,"1 month",NA,NA,NA,NA,"laypeople",NA,NA,NA,NA,"cardiac patients",NA,NA,NA,NA,"adults",NA,NA,NA,NA,"israel",NA,NA,NA,NA,138,NA,NA,NA,NA,0.12,NA,NA,NA,NA,"60.95",NA,NA,NA,NA,10.04,NA,NA,NA,NA,NA,NA,NA,NA,NA,NA,NA,NA,NA,NA
"183","Wirz","Evaluating the Effects of News-following, Volume and Content of News Coverage on Americans’ Risk Perceptions during the 2014-2016 Ebola Outbreak",2021,"we analyzed how public opinion from longitudinal u.s. panel data related to the number of published news articles and the proportion that discussed risks.","longitudinal panel study of americans’ ebola views from a national sample, members of the decision research online panel","longitudinal","risk",NA,NA,NA,NA,"scale",NA,NA,NA,NA,"6-point likert scale",NA,NA,NA,NA,"judged risk of ebola to the u.s. and globally.",NA,NA,NA,NA,"4",NA,NA,NA,NA,"single",NA,NA,NA,NA,NA,NA,NA,NA,NA,NA,NA,NA,NA,NA,"ebola",NA,NA,NA,NA,NA,NA,NA,NA,NA,"health; health catastrophe; other: media","yes",NA,NA,NA,NA,"temporal trend",NA,NA,NA,NA,NA,NA,NA,NA,NA,"significant",NA,NA,NA,NA,NA,NA,NA,NA,NA,"u.s. risk perceptions decreased over the course of the three surveys",NA,NA,NA,NA,NA,NA,NA,NA,NA,"34 days",NA,NA,NA,NA,NA,NA,NA,NA,NA,"laypeople",NA,NA,NA,NA,NA,NA,NA,NA,NA,"adults",NA,NA,NA,NA,"united states of america",NA,NA,NA,NA,815,NA,NA,NA,NA,0.52,NA,NA,NA,NA,"45.15",NA,NA,NA,NA,NA,NA,NA,NA,NA,NA,NA,NA,NA,NA,NA,NA,NA,NA,NA
"184","Bhandari","Emotional States and Their Impact on Hazard Identification Skills",2016,"this study examines the connection between emotion 
and hazard recognition.",NA,"longitudinal","risk",NA,NA,NA,NA,"scale",NA,NA,NA,NA,"9-point likert",NA,NA,NA,NA,"participants were asked to rate the frequency with which an injury may occur at various levels of severity. risk perception was then quantified for each severity level by finding the product of frequency and the severity. the overall risk perception for a particular participant and a particular photograph was measured by taking the average across all severity levels.",NA,NA,NA,NA,"2",NA,NA,NA,NA,"single",NA,NA,NA,NA,"induce target emotions with auto-bio recall",NA,NA,NA,NA,"1",NA,NA,NA,NA,NA,NA,NA,NA,NA,NA,NA,NA,NA,NA,"other: safety and hazard recognition","yes",NA,NA,NA,NA,"mean difference",NA,NA,NA,NA,NA,NA,NA,NA,NA,NA,NA,NA,NA,NA,"not significant",NA,NA,NA,NA,NA,NA,NA,NA,NA,NA,NA,NA,NA,NA,NA,NA,NA,NA,NA,NA,NA,NA,NA,NA,"laypeople",NA,NA,NA,NA,"students",NA,NA,NA,NA,"adults",NA,NA,NA,NA,"united states of america",NA,NA,NA,NA,45,NA,NA,NA,NA,0.24,NA,NA,NA,NA,NA,NA,NA,NA,NA,NA,NA,NA,NA,NA,NA,NA,NA,NA,NA,NA,NA,NA,NA,NA
"185","Mullins","Human Papillomavirus Vaccine-Related Risk Perceptions and  Subsequent Sexual Behaviors and Sexually Transmitted Infections among Vaccinated Adolescent Women",2016,"to examine the association between risk perceptions after human papillomavirus (hpv) vaccination and sexual behaviors and sexually transmitted infection (sti) diagnosis over 30 months following vaccination.",NA,"longitudinal","risk",NA,NA,NA,NA,"scale",NA,NA,NA,NA,"10-point visual analog scale",NA,NA,NA,NA,"10 items",NA,NA,NA,NA,"5",NA,NA,NA,NA,"single",NA,NA,NA,NA,"first human papillomavirus vaccine dose",NA,NA,NA,NA,NA,NA,NA,NA,NA,NA,NA,NA,NA,NA,NA,NA,NA,NA,NA,"health; other: human papillomavirus vaccine","yes",NA,NA,NA,NA,"temporal trend",NA,NA,NA,NA,NA,NA,NA,NA,NA,"significant",NA,NA,NA,NA,NA,NA,NA,NA,NA,"perceived risk of stis other than hpv decreased over time  (p=0.027)",NA,NA,NA,NA,NA,NA,NA,NA,NA,"7.5 months",NA,NA,NA,NA,NA,NA,NA,NA,NA,"laypeople",NA,NA,NA,NA,"only female",NA,NA,NA,NA,"adolescents and young adults",NA,NA,NA,NA,"united states of america",NA,NA,NA,NA,112,NA,NA,NA,NA,1,NA,NA,NA,NA,"17.9",NA,NA,NA,NA,2.2,NA,NA,NA,NA,13,NA,NA,NA,NA,21,NA,NA,NA,NA
"186","Kang","Reliability and Validity of the Korean Version of the Penn State Worry Questionnaire in Primary School Children",2010,"this study investigated the reliability and validity of the korean version of the penn state worry questionnaire for children (pswq-ck).",NA,"longitudinal","worry",NA,NA,NA,NA,"scale",NA,NA,NA,NA,"5-point likert scale",NA,NA,NA,NA,"pswq-c is a 14-item questionnaire for measuring whether 
children have excessive, generalized, and uncontrollable wor-
ries",NA,NA,NA,NA,"2",NA,NA,NA,NA,"single",NA,NA,NA,NA,NA,NA,NA,NA,NA,NA,NA,NA,NA,NA,NA,NA,NA,NA,NA,NA,NA,NA,NA,NA,"health; other: questionnaire validation","yes",NA,NA,NA,NA,"test-retest",NA,NA,NA,NA,"r = .83",NA,NA,NA,NA,NA,NA,NA,NA,NA,NA,NA,NA,NA,NA,NA,NA,NA,NA,NA,"3 weeks",NA,NA,NA,NA,NA,NA,NA,NA,NA,NA,NA,NA,NA,NA,"laypeople",NA,NA,NA,NA,"students",NA,NA,NA,NA,"children",NA,NA,NA,NA,"south korea",NA,NA,NA,NA,883,NA,NA,NA,NA,NA,NA,NA,NA,NA,"10.6",NA,NA,NA,NA,1.1,NA,NA,NA,NA,8,NA,NA,NA,NA,12,NA,NA,NA,NA
"187","Brown","Relationships between risk-taking behaviour and subsequent risk perceptions",2005,"the aim of this study was to examine this relationship
using estimates of personal risk inherent in exceeding limits in common speed zones, rather than traditional risk perception items that can be confounded by engagement in risk taking",NA,"longitudinal","risk",NA,NA,NA,NA,"scale",NA,NA,NA,NA,"5-point likert",NA,NA,NA,NA,"risk perfception = risk estimates and risk beliefs",NA,NA,NA,NA,"2",NA,NA,NA,NA,"single",NA,NA,NA,NA,"a campaign against speeding",NA,NA,NA,NA,NA,NA,NA,NA,NA,NA,NA,NA,NA,NA,NA,NA,NA,NA,NA,"other: speeding","yes",NA,NA,NA,NA,"mean difference",NA,NA,NA,NA,NA,NA,NA,NA,NA,NA,NA,NA,NA,NA,"significant",NA,NA,NA,NA,"t1 - t2 (perceived danger at 70) 
t1 - t2 (perceived danger at 80)",NA,NA,NA,NA,NA,NA,NA,NA,NA,NA,NA,NA,NA,NA,"14 weeks",NA,NA,NA,NA,"laypeople",NA,NA,NA,NA,NA,NA,NA,NA,NA,"adults",NA,NA,NA,NA,"united kingdom",NA,NA,NA,NA,255,NA,NA,NA,NA,0.53,NA,NA,NA,NA,"42",NA,NA,NA,NA,13.49,NA,NA,NA,NA,NA,NA,NA,NA,NA,NA,NA,NA,NA,NA
"188","Visschers","How a Nuclear Power Plant Accident Influences Acceptance of Nuclear Power: Results of a Longitudinal Study Before and After the Fukushima Disaster",2013,"in a longitudinal study that included two waves, we examined how the accident at the nuclear power plant in fukushima changed people’s trust, their perceptions of benefits and risks, and their acceptance of nuclear power in the german-speaking part of switzerland.",NA,"longitudinal","risk",NA,NA,NA,NA,"questionnaire",NA,NA,NA,NA,"7-point likert scale",NA,NA,NA,NA,"items in the questionnaire to assess risk perception",NA,NA,NA,NA,"2",NA,NA,NA,NA,"single",NA,NA,NA,NA,NA,NA,NA,NA,NA,NA,NA,NA,NA,NA,"fukushima nuclear power plant accident. survey conducted in switzerland",NA,NA,NA,NA,1,NA,NA,NA,NA,"nuclear power accidents","yes",NA,NA,NA,NA,"mean difference",NA,NA,NA,NA,NA,NA,NA,NA,NA,NA,NA,NA,NA,NA,"significant",NA,NA,NA,NA,NA,NA,NA,NA,NA,"t1-t2 (before and after fukushima). respondents’ level of risk
perception significantly increased after the nuclear
accident. however, the sizes of the differences (i.e.,
0.79 at maximum for perceived risks, measured on 7-
point likert scales) between the two surveys indicate
that respondents had not completely changed their
views on nuclear power.",NA,NA,NA,NA,NA,NA,NA,NA,NA,"1 year",NA,NA,NA,NA,"laypeople",NA,NA,NA,NA,NA,NA,NA,NA,NA,"adults",NA,NA,NA,NA,"switzerland",NA,NA,NA,NA,790,NA,NA,NA,NA,0.32,NA,NA,NA,NA,"57.15",NA,NA,NA,NA,15.02,NA,NA,NA,NA,NA,NA,NA,NA,NA,NA,NA,NA,NA,NA
"189","Ullrich-Kleinmanns","Patterns and Course of Psychoactive Drug Use During Adolescence: the Relevance of Risk Perceptions and Sense of Coherence as Protective Factors",2008,"to describe the patterns and course 
of use of psychoactives among adolescents and 
to analyse the relevance of risk perceptions and 
sense of coherence as protective factors.","risa panel study","longitudinal","risk",NA,NA,NA,NA,"scale",NA,NA,NA,NA,NA,NA,NA,NA,NA,"in order to assess the risk perception with regard to psychoactive substances, the adolescents were asked at all survey times how risky they considered the use of various psychoactive substances to be for humans in general (general risk perception). 
(general risk perception). in addition, the users of various substances were asked how risky they considered their own use of the respective substance to be. 
(personal risk perception).",NA,NA,NA,NA,"7",NA,NA,NA,NA,"single",NA,NA,NA,NA,NA,NA,NA,NA,NA,NA,NA,NA,NA,NA,NA,NA,NA,NA,NA,NA,NA,NA,NA,NA,"cigarettes ; drugs","yes",NA,NA,NA,NA,"temporal trend",NA,NA,NA,NA,NA,NA,NA,NA,NA,"not significant",NA,NA,NA,NA,NA,NA,NA,NA,NA,"the general risk perception proves to be a relatively stable cognition. the already mentioned finding that tobacco and alcohol consumption are assessed in roughly the same way, while cannabis consumption is assessed as more dangerous than the two legal drugs, also remains unchanged over time.",NA,NA,NA,NA,NA,NA,NA,NA,NA,"6 months",NA,NA,NA,NA,NA,NA,NA,NA,NA,"laypeople",NA,NA,NA,NA,"students",NA,NA,NA,NA,"adolescents",NA,NA,NA,NA,NA,NA,NA,NA,NA,318,NA,NA,NA,NA,0.51,NA,NA,NA,NA,"14",NA,NA,NA,NA,0.61,NA,NA,NA,NA,NA,NA,NA,NA,NA,NA,NA,NA,NA,NA
"190","Choi","Keep your distance: Different roles for knowledge and affect in predicting social distancing behavior",2022,"the current study examines predictors of social distancing behavior across populations (students and community members) and across time in the early months of the covid-19 pandemic, focusing on two 
factors commonly associated with risk perception and prevention: knowledge and affect.","https://osf.io/9wgq8/view_only=4c9812d39b8e4b1d91a17ac73a954107","longitudinal","threat",NA,NA,NA,NA,"scale",NA,NA,NA,NA,"7-point likert scale (strongly disagree - strongly agree)",NA,NA,NA,NA,"for an index of negative affect, we averaged participants’ responses 
on how vulnerable they felt to covid-19 and how concerned they were about potentially catching covid-19. participants also completed a set of individual difference measures that tap into chronic levels of threat perception.",NA,NA,NA,NA,"2",NA,NA,NA,NA,"single",NA,NA,NA,NA,"yes",NA,NA,NA,NA,"once",NA,NA,NA,NA,"covid-19",NA,NA,NA,NA,NA,NA,NA,NA,NA,"health catastrophe; other: threat perception and social distancing behavior","no",NA,NA,NA,NA,NA,NA,NA,NA,NA,NA,NA,NA,NA,NA,NA,NA,NA,NA,NA,NA,NA,NA,NA,NA,NA,NA,NA,NA,NA,NA,NA,NA,NA,NA,NA,NA,NA,NA,NA,NA,NA,NA,NA,NA,NA,NA,NA,NA,NA,NA,NA,NA,NA,NA,NA,NA,NA,NA,NA,NA,NA,NA,NA,NA,NA,NA,NA,NA,NA,NA,NA,NA,NA,NA,NA,NA,NA,NA,NA,NA,NA,NA,NA,NA,NA,NA,NA,NA,NA,NA,NA,NA,NA,NA
"191","Qin","Tracing Temporal Changes in the Human Dimensions of Forest Insect Disturbance on the Kenai Peninsula, Alaska",2015,"our research focused on whether local risk perceptions and community actions in response to the infestation changed as natural disturbances and hazards varied from one event to another.",NA,"longitudinal","risk",NA,NA,NA,NA,"scale",NA,NA,NA,NA,"5-point likert scale",NA,NA,NA,NA,"direct/indirect risk perception: rate concern about a series of forest risks on a scale from 1 to 5
(1=not concerned, 5=extremely concerned). factor analysis revealed two factors among these variables: (1) direct risk perception/perception of immediate threats to personal property
and safety (forest fire, grass fire, and falling trees); and (2) indirect risk perception/perception of broader threats to
community and ecological well-being (loss of community identity tied to the forest, loss of forest as an economic resource, decline in fish and wildlife habitat, increased
erosion and runoff, and loss of scenic/aesthetic quality). composite index variables were created by calculating the mean response value of each risk perception category",NA,NA,NA,NA,"3",NA,NA,NA,NA,"single",NA,NA,NA,NA,NA,NA,NA,NA,NA,NA,NA,NA,NA,NA,NA,NA,NA,NA,NA,NA,NA,NA,NA,NA,"natural catastrophe; other: forest insect disturbance","yes",NA,NA,NA,NA,"mean difference",NA,NA,NA,NA,NA,NA,NA,NA,NA,NA,NA,NA,NA,NA,"significant",NA,NA,NA,NA,"t1-t2, significant for some communities",NA,NA,NA,NA,NA,NA,NA,NA,NA,NA,NA,NA,NA,NA,"4 years",NA,NA,NA,NA,"laypeople",NA,NA,NA,NA,NA,NA,NA,NA,NA,"adults",NA,NA,NA,NA,"usa",NA,NA,NA,NA,433,NA,NA,NA,NA,NA,NA,NA,NA,NA,NA,NA,NA,NA,NA,NA,NA,NA,NA,NA,NA,NA,NA,NA,NA,NA,NA,NA,NA,NA
"192","Fu","Informational support, risk perception, anti-pandemic motivation and behavior: a longitudinal study in China",2023,"to investigate the associations among informational support from three different channels, two individual internal factors, and two kinds of anti-pandemic behavior","data available upon request","longitudinal","risk",NA,NA,NA,NA,"scale",NA,NA,NA,NA,"5-point likert scale",NA,NA,NA,NA,"3 items",NA,NA,NA,NA,"3",NA,NA,NA,NA,"single",NA,NA,NA,NA,NA,NA,NA,NA,NA,NA,NA,NA,NA,NA,"covid-19",NA,NA,NA,NA,NA,NA,NA,NA,NA,"health catastrophe","yes",NA,NA,NA,NA,"mean difference",NA,NA,NA,NA,NA,NA,NA,NA,NA,NA,NA,NA,NA,NA,"significant",NA,NA,NA,NA,"stage 1 - stage 3",NA,NA,NA,NA,NA,NA,NA,NA,NA,NA,NA,NA,NA,NA,"4.5 months",NA,NA,NA,NA,"laypeople",NA,NA,NA,NA,NA,NA,NA,NA,NA,"adults",NA,NA,NA,NA,"china",NA,NA,NA,NA,1233,NA,NA,NA,NA,0.48,NA,NA,NA,NA,NA,NA,NA,NA,NA,NA,NA,NA,NA,NA,16,NA,NA,NA,NA,74,NA,NA,NA,NA
"193","Elad-Strenger","Revisiting the Effects of Societal Threat Perceptions on
Conflict-related Positions: A Three-wave Study",2018,"the aim of this study was to examine the hypothesis that although certain types of perceived societal threats are associated with adherence to conservative political
positions, other types of perceived societal threat can be associated with increased endorsement of liberal political positions.","midgam project web panel","longitudinal","threat",NA,NA,NA,NA,"scale",NA,NA,NA,NA,"7-point likert scale",NA,NA,NA,NA,"liberal threat and conservative threat",NA,NA,NA,NA,"3",NA,NA,NA,NA,"single",NA,NA,NA,NA,NA,NA,NA,NA,NA,NA,NA,NA,NA,NA,"real-life political events",NA,NA,NA,NA,NA,NA,NA,NA,NA,"other: political","yes",NA,NA,NA,NA,"correlation",NA,NA,NA,NA,"liberal t1-t2: 0.47
liberal t2-t3: 0.54
conservative t1-t2: 0.52
conservative t2-t3: 0.38",NA,NA,NA,NA,NA,NA,NA,NA,NA,NA,NA,NA,NA,NA,"t1-t2
t2-t3",NA,NA,NA,NA,"3 months",NA,NA,NA,NA,NA,NA,NA,NA,NA,NA,NA,NA,NA,NA,"laypeople",NA,NA,NA,NA,"jewish-israelis",NA,NA,NA,NA,"adults",NA,NA,NA,NA,"israel",NA,NA,NA,NA,437,NA,NA,NA,NA,0.52,NA,NA,NA,NA,"41.2",NA,NA,NA,NA,15.5,NA,NA,NA,NA,19,NA,NA,NA,NA,77,NA,NA,NA,NA
"194","Tu","Mass media, information and demand for environmental quality: Evidence from the “Under the Dome”",2020,"this paper estimates the effect of mass media on public willingness to pay (wtp) for better environmental quality.",NA,"longitudinal","risk",NA,NA,NA,NA,"scale",NA,NA,NA,NA,"5-point likert scale",NA,NA,NA,NA,"health and environmental risk perception",NA,NA,NA,NA,"27",NA,NA,NA,NA,"single",NA,NA,NA,NA,NA,NA,NA,NA,NA,NA,NA,NA,NA,NA,"documentary “under the dome” is a famous event
about the problem of air pollution in china which is produced by the well-known journalist – chai jing.",NA,NA,NA,NA,1,NA,NA,NA,NA,"health; other: media, environment and air pollution","no",NA,NA,NA,NA,NA,NA,NA,NA,NA,NA,NA,NA,NA,NA,NA,NA,NA,NA,NA,NA,NA,NA,NA,NA,NA,NA,NA,NA,NA,NA,NA,NA,NA,NA,NA,NA,NA,NA,NA,NA,NA,NA,NA,NA,NA,NA,NA,NA,NA,NA,NA,NA,NA,NA,NA,NA,NA,NA,NA,NA,NA,NA,NA,NA,NA,NA,NA,NA,NA,NA,NA,NA,NA,NA,NA,NA,NA,NA,NA,NA,NA,NA,NA,NA,NA,NA,NA,NA,NA,NA,NA,NA,NA,NA
"195","Lipkus","Breast cancer risk perceptions and breast cancer worry: what predicts what?",2005,"in this article, we review and then provide data about how the target of estimated risk (perceived absolute and comparative) and whether women’s risk perceptions are accurate or biased (based on their gail model scores) relate to their worry about breast cancer, using both cross-sectional and prospective data.",NA,"serial-cross sectional","risk","risk","worry",NA,NA,"scale","single item","scale",NA,NA,"0–100% point scale and 6-point likert scale","5-point likert scale: much below average, slightly below average, same average risk, slightly above average, and much above average","6-point likert scale",NA,NA,"2 items.
perceptions of absolute risk. women rated their numerical risk on a 0–100% point scale where 0%5no chance and 100%5certain to happen. the verbal estimate was
based on 6-point likert scales using the same anchors (15no chance to 65certain to
happen). using the same numerical and verbal scales, participants also rated the perceived
absolute risk for a woman their age and race without any known risk factors.
","perceptions of comparative risk. participants estimated their lifetime chance of getting breast cancer compared to a woman","3 items.
women were asked separately how worried, fearful, and anxious they were of getting breast cancer in their lifetime;",NA,NA,"2",2,2,NA,NA,"single","single","single",NA,NA,NA,NA,NA,NA,NA,NA,NA,NA,NA,NA,NA,NA,NA,NA,NA,NA,NA,NA,NA,NA,"cancer ; other: breast cancer","no","no","no",NA,NA,NA,NA,NA,NA,NA,NA,NA,NA,NA,NA,NA,NA,NA,NA,NA,NA,NA,NA,NA,NA,NA,NA,NA,NA,NA,NA,NA,NA,NA,NA,NA,NA,NA,NA,NA,NA,NA,NA,NA,NA,NA,NA,NA,NA,NA,NA,NA,NA,NA,NA,NA,NA,NA,NA,NA,NA,NA,NA,NA,NA,NA,NA,NA,NA,NA,NA,NA,NA,NA,NA,NA,NA,NA,NA,NA,NA,NA,NA,NA,NA,NA,NA,NA,NA,NA,NA,NA,NA,NA,NA
"196","Tenkorang","Perceived vulnerability and HIV testing among youth in Cape Town, South Africa",2016,"this paper adds to the extant literature by using longitudinal data to examine if changes in the perceived vulnerability of youth in cape town south africa are associated with changes in hiv testing behaviors.","cape area panel survey (caps)","longitudinal","risk",NA,NA,NA,NA,"scale",NA,NA,NA,NA,"4-point likert scale: no risk, small risk, medium risk, great risk",NA,NA,NA,NA,"these include questions that asked youth their perceived risks of contracting hiv and if they know of someone infected with hiv.",NA,NA,NA,NA,"2",NA,NA,NA,NA,"single",NA,NA,NA,NA,NA,NA,NA,NA,NA,NA,NA,NA,NA,NA,NA,NA,NA,NA,NA,NA,NA,NA,NA,NA,"health; other: hiv","no",NA,NA,NA,NA,NA,NA,NA,NA,NA,NA,NA,NA,NA,NA,NA,NA,NA,NA,NA,NA,NA,NA,NA,NA,NA,NA,NA,NA,NA,NA,NA,NA,NA,NA,NA,NA,NA,NA,NA,NA,NA,NA,NA,NA,NA,NA,NA,NA,NA,NA,NA,NA,NA,NA,NA,NA,NA,NA,NA,NA,NA,NA,NA,NA,NA,NA,NA,NA,NA,NA,NA,NA,NA,NA,NA,NA,NA,NA,NA,NA,NA,NA,NA,NA,NA,NA,NA,NA,NA,NA,NA,NA,NA,NA
