"","author","paper_title","publication_year","aim_study","data_availability","study_design","risk_1","risk_2","risk_3","risk_4","risk_5","measured_1","measured_2","measured_3","measured_4","measured_5","units_assessed_1","units_assessed_2","units_assessed_3","units_assessed_4","units_assessed_5","how_computed_1","how_computed_2","how_computed_3","how_computed_4","how_computed_5","times_measured_1","times_measured_2","times_measured_3","times_measured_4","times_measured_5","study_1","study_2","study_3","study_4","study_5","intervention_1","intervention_2","intervention_3","intervention_4","intervention_5","intervention_times_1","intervention_times_2","intervention_times_3","intervention_times_4","intervention_times_5","exposure_1","exposure_2","exposure_3","exposure_4","exposure_5","exposure_times_1","exposure_times_2","exposure_times_3","exposure_times_4","exposure_times_5","domain","temporal_analysis_1","temporal_analysis_2","temporal_analysis_3","temporal_analysis_4","temporal_analysis_5","how_analyzed_1","how_analyzed_2","how_analyzed_3","how_analyzed_4","how_analyzed_5","test-retest_result_1","test-retest_result_2","test-retest_result_3","test-retest_result_4","test-retest_result_5","temporal_trend_result_1","temporal_trend_result_2","temporal_trend_result_3","temporal_trend_result_4","temporal_trend_result_5","mean_difference_result_1","mean_difference_result_2","mean_difference_result_3","mean_difference_result_4","mean_difference_result_5","comparison_significant_1","comparison_significant_2","comparison_significant_3","comparison_significant_4","comparison_significant_5","test-retest_interval_1","test-retest_interval_2","test-retest_interval_3","test-retest_interval_4","test-retest_interval_5","temporal_trend_interval_1","temporal_trend_interval_2","temporal_trend_interval_3","temporal_trend_interval_4","temporal_trend_interval_5","mean_difference_interval_1","mean_difference_interval_2","mean_difference_interval_3","mean_difference_interval_4","mean_difference_interval_5","type_participants_1","type_participants_2","type_participants_3","type_participants_4","type_participants_5","characteristics_sample_1","characteristics_sample_2","characteristics_sample_3","characteristics_sample_4","characteristics_sample_5","age_category_1","age_category_2","age_category_3","age_category_4","age_category_5","country_1","country_2","country_3","country_4","country_5","sample_size_1","sample_size_2","sample_size_3","sample_size_4","sample_size_5","prop_female_1","prop_female_2","prop_female_3","prop_female_4","prop_female_5","mean_age_1","mean_age_2","mean_age_3","mean_age_4","mean_age_5","SD_age_1","SD_age_2","SD_age_3","SD_age_4","SD_age_5","lowest_age_1","lowest_age_2","lowest_age_3","lowest_age_4","lowest_age_5","highest_age_1","highest_age_2","highest_age_3","highest_age_4","highest_age_5"
"1","Bish","No news is (not necessarily) good news: Impact of preliminary results for BRCA1 mutation searches",2002,"the current study aims to examine how the continuing uncertainty affects mood (including perceptions of risk) and reported behavior",NA,"longitudinal","risk","worry",NA,NA,NA,"scale","scale",NA,NA,NA,"5-point likert scale","4-point likert scale",NA,NA,NA,"two measures: one assessed perceptions about breast cancer relative to other women of their age. the other measure assessed perceived likelihood that they carried a mutation.","worry about breast cancer and ovarian cancer",NA,NA,NA,"3",3,NA,NA,NA,"single","single",NA,NA,NA,"genetic counseling for breast cancer",NA,NA,NA,NA,NA,NA,NA,NA,NA,NA,NA,NA,NA,NA,NA,NA,NA,NA,NA,"cancer","yes","yes",NA,NA,NA,"mean difference","mean difference",NA,NA,NA,NA,NA,NA,NA,NA,NA,NA,NA,NA,NA,"significant","not significant",NA,NA,NA,"preresult - postresult
(2 weeks postresult)","preresult, 2 weeks post result and 6months post results",NA,NA,NA,NA,NA,NA,NA,NA,NA,NA,NA,NA,NA,"2 weeks",NA,NA,NA,NA,"laypeople","laypeople",NA,NA,NA,"cancer counselee","cancer counselee",NA,NA,NA,"adults","adults",NA,NA,NA,"united kingdom","united kingdom",NA,NA,NA,61,61,NA,NA,NA,1,1,NA,NA,NA,"52.1",52.1,NA,NA,NA,11.1,11.1,NA,NA,NA,32,32,NA,NA,NA,74,74,NA,NA,NA
"2","Smith","Why are they worried? Concern about HIV/AIDS in rural Malawi",2003,"what factors determine how much a person worries about hiv/aids, and are the predominant factors those that individual models would suggest, or are there are other determinants that have a greater impact on worry",NA,"longitudinal","worry",NA,NA,NA,NA,"single item",NA,NA,NA,NA,"3-point likert scale",NA,NA,NA,NA,"single item: “how worried are you that you might catch aids?”",NA,NA,NA,NA,"2",NA,NA,NA,NA,"single",NA,NA,NA,NA,NA,NA,NA,NA,NA,NA,NA,NA,NA,NA,NA,NA,NA,NA,NA,NA,NA,NA,NA,NA,"health; health catastrophe; other: hiv/aids","yes",NA,NA,NA,NA,"mean difference",NA,NA,NA,NA,NA,NA,NA,NA,NA,NA,NA,NA,NA,NA,"significant",NA,NA,NA,NA,"t1-t2",NA,NA,NA,NA,NA,NA,NA,NA,NA,NA,NA,NA,NA,NA,"3 years",NA,NA,NA,NA,"laypeople",NA,NA,NA,NA,NA,NA,NA,NA,NA,"adults",NA,NA,NA,NA,"malawi",NA,NA,NA,NA,1538,NA,NA,NA,NA,0.57,NA,NA,NA,NA,NA,NA,NA,NA,NA,NA,NA,NA,NA,NA,NA,NA,NA,NA,NA,NA,NA,NA,NA,NA
"3","Cabrera","The impact of genetic counseling on knowledge and emotional responses in Spanish population with family history of breast cancer",2010,"to assess a genetic counseling intervention measuring the distress, cancer risk perception, anxiety, worry and level of knowledge in people with familial history of breast cancer.",NA,"longitudinal","risk","worry",NA,NA,NA,"single item","scale",NA,NA,NA,"3-point likert","total scores range from 6 to 24 where a higher score indicates higher levels of
cancer’s worry",NA,NA,NA,"1 item","6 items",NA,NA,NA,"3",3,NA,NA,NA,"single","single",NA,NA,NA,"pre- and post cancer-genetic intervention","pre- and post cancer-genetic intervention",NA,NA,NA,"2",2,NA,NA,NA,NA,NA,NA,NA,NA,NA,NA,NA,NA,NA,"cancer","yes","yes",NA,NA,NA,"mean difference","mean difference",NA,NA,NA,NA,NA,NA,NA,NA,NA,NA,NA,NA,NA,"not significant","significant",NA,NA,NA,NA,"pre- post counseling (1 month after) 
pre- post counseling (6 months after)
",NA,NA,NA,NA,NA,NA,NA,NA,NA,NA,NA,NA,NA,NA,"3.5 months",NA,NA,NA,"laypeople","laypeople",NA,NA,NA,"people with history of breast cancer","people with history of breast cancer",NA,NA,NA,"adults","adults",NA,NA,NA,"spain","spain",NA,NA,NA,212,212,NA,NA,NA,0.94,0.94,NA,NA,NA,"38.4",38.4,NA,NA,NA,11.4,11.4,NA,NA,NA,NA,NA,NA,NA,NA,NA,NA,NA,NA,NA
"4","Maheu","Pancreatic cancer risk counselling and screening: impact on perceived risk and psychological functioning",2010,"the purpose of this study was to examine the psycho-
social impact of participating in a pancreatic cancer counselling and screening program from baseline to 3 months post intervention for individuals with a family
history of pancreatic cancer (fpc group) and for individuals with brca2 mutations (brca2 group).",NA,"longitudinal","risk","worry",NA,NA,NA,"single item","single item",NA,NA,NA,"0% - 100%","4-point likert scale",NA,NA,NA,"individuals were asked to rate their perceived lifetime risk of developing pancreatic cancer on a scale from 0 to 100%.","cancer worry scale,  participants were asked to report their frequency of worry about developing
pancreatic cancer in the previous month",NA,NA,NA,"2",2,NA,NA,NA,"single","single",NA,NA,NA,"the pancreatic cancer counselling and screening program involves annual transcutaneous abdominal ultrasound, magnetic resonance imaging (mri), and blood collection (for future biomarker studies). participants were asked to
return once a year for 5 years. prior to their first scheduled screening appointment, participants were mailed a baseline
psychosocial questionnaire along with a study consent
form. they were asked to bring the completed questionnaire to their first study appointment. genetic counseling was provided prior to the procedures in the majority of cases and involved obtaining updates regarding medical and family history, discussion about the lack of clinical
screening recommendations for pancreatic cancer, the
potential risks, benefits and limitations of study participation, and general information about pancreatic cancer, including population risks, and risk factors for this disease. an estimated 5% lifetime risk for developing pancreatic","the pancreatic cancer counselling and screening program involves annual transcutaneous abdominal ultrasound, magnetic resonance imaging (mri), and blood collection (for future biomarker studies). participants were asked to
return once a year for 5 years. prior to their first scheduled screening appointment, participants were mailed a baseline
psychosocial questionnaire along with a study consent
form. they were asked to bring the completed questionnaire to their first study appointment. genetic counseling was provided prior to the procedures in the majority of cases and involved obtaining updates regarding medical and family history, discussion about the lack of clinical
screening recommendations for pancreatic cancer, the
potential risks, benefits and limitations of study participation, and general information about pancreatic cancer, including population risks, and risk factors for this disease. an estimated 5% lifetime risk for developing pancreatic",NA,NA,NA,"1",1,NA,NA,NA,NA,NA,NA,NA,NA,NA,NA,NA,NA,NA,"cancer","yes","yes",NA,NA,NA,"mean difference","mean difference",NA,NA,NA,NA,NA,NA,NA,NA,NA,NA,NA,NA,NA,"not significant","significant",NA,NA,NA,NA,"t1-t2, pre-post, cancer worry declined across time,",NA,NA,NA,NA,NA,NA,NA,NA,NA,NA,NA,NA,NA,"3 months","3 months",NA,NA,NA,"laypeople","laypeople",NA,NA,NA,"individuals with a family history of pancreatic cancer or brca2 mutation carriers","individuals with a family history of pancreatic cancer or brca2 mutation carriers",NA,NA,NA,"adults","adults",NA,NA,NA,"canadia","canadia",NA,NA,NA,198,198,NA,NA,NA,0.51,0.51,NA,NA,NA,"56.4",56.4,NA,NA,NA,9.2,9.2,NA,NA,NA,32,32,NA,NA,NA,89,89,NA,NA,NA
"5","Malnar","Forty years of environmental risk perceptions: Evidence from the slovenian public opinion survey",2012,"this paper examines a forty-year dynamic of  concern for the environment among slovenian respondents. it first makes an inventory of the variables that are presumed to influence perceptions of environmental risk, then proceeds to analyse twelve slovenia public opinion datasets to observe the trends",NA,"longitudinal","risk",NA,NA,NA,NA,"scale",NA,NA,NA,NA,"5-point likert scale",NA,NA,NA,NA,"5 items.
our dependant concept is the perception of environmental risks. the 
question wording was: do the following phenomena in your living and 
working environment threaten you, concern you, or are non-existent? (air 
pollution, water pollution, nuclear waste, forest decay).",NA,NA,NA,NA,"12",NA,NA,NA,NA,"single",NA,NA,NA,NA,NA,NA,NA,NA,NA,NA,NA,NA,NA,NA,NA,NA,NA,NA,NA,NA,NA,NA,NA,NA,"natural catastrophe; other: environmental: (air pollution, water pollution, nuclear waste, forest decay)","yes",NA,NA,NA,NA,"temporal trend",NA,NA,NA,NA,NA,NA,NA,NA,NA,"significant",NA,NA,NA,NA,NA,NA,NA,NA,NA,"despite the fact that the four items under observation rep-
resent a rather diverse set of environmental threats, their trajectory is similar. 
all of them seem to grow and fall in parallel, a pattern which suggests that 
their distinctive content was lost on respondents.",NA,NA,NA,NA,NA,NA,NA,NA,NA,"3.5 years",NA,NA,NA,NA,NA,NA,NA,NA,NA,"laypeople",NA,NA,NA,NA,NA,NA,NA,NA,NA,"adults",NA,NA,NA,NA,"slovenia",NA,NA,NA,NA,1082,NA,NA,NA,NA,NA,NA,NA,NA,NA,NA,NA,NA,NA,NA,NA,NA,NA,NA,NA,NA,NA,NA,NA,NA,NA,NA,NA,NA,NA
"6","Matson","The role of feelings of intimacy on perceptions of risk
for a sexually transmitted disease and condom use in the sexual relationships of adolescent AfricaneAmerican females",2012,"the objective of this analysis was to examine the role of intimacy on perceptions of risk for an std (prstd) and condom use within late adolescent females’ main relationships.",NA,"longitudinal","risk",NA,NA,NA,NA,"single item",NA,NA,NA,NA,"5-item likert scale",NA,NA,NA,NA,"1 item
for each partner, participants were asked “how likely are you to
get an std from this partner if you do not use a condom with
him?”",NA,NA,NA,NA,"7",NA,NA,NA,NA,"single",NA,NA,NA,NA,NA,NA,NA,NA,NA,NA,NA,NA,NA,NA,NA,NA,NA,NA,NA,NA,NA,NA,NA,NA,"health; other: feelings of intimacy and condom use","no",NA,NA,NA,NA,NA,NA,NA,NA,NA,NA,NA,NA,NA,NA,NA,NA,NA,NA,NA,NA,NA,NA,NA,NA,NA,NA,NA,NA,NA,NA,NA,NA,NA,NA,NA,NA,NA,NA,NA,NA,NA,NA,NA,NA,NA,NA,NA,NA,NA,NA,NA,NA,NA,NA,NA,NA,NA,NA,NA,NA,NA,NA,NA,NA,NA,NA,NA,NA,NA,NA,NA,NA,NA,NA,NA,NA,NA,NA,NA,NA,NA,NA,NA,NA,NA,NA,NA,NA,NA,NA,NA,NA,NA,NA
"7","Park","Examining Whether Lung Screening Changes Risk Perceptions: National Lung Screening Trial Participants at 1-Year Follow-up",2013,"the objectives of the current study were to examine, at 1-year follow-up: 1) risk perceptions of lung cancer and smoking-related diseases and behavior change determinants, 2) whether changes in risk perceptions differed by baseline screening result; and 3) whether changes in risk perceptions affected smoking behavior.",NA,"longitudinal","risk",NA,NA,NA,NA,"scale",NA,NA,NA,NA,"5-point likert scale",NA,NA,NA,NA,"10 items. 
smoking risk perception scale",NA,NA,NA,NA,"2",NA,NA,NA,NA,"single",NA,NA,NA,NA,NA,NA,NA,NA,NA,NA,NA,NA,NA,NA,NA,NA,NA,NA,NA,NA,NA,NA,NA,NA,"cancer ; cigarettes","yes",NA,NA,NA,NA,"mean difference",NA,NA,NA,NA,NA,NA,NA,NA,NA,NA,NA,NA,NA,NA,"current smokers: changes in lung cancer risk -> .69
changes in srd risk -> .97

former smokers: 
changes in lung cancer risk -> .62
changes in srd risk -> .37",NA,NA,NA,NA,"lung cancer risk perceptions did not change
significantly from baseline to 1-year follow-up; srd risk perceptions did not
change over time;  in terms of determi-
nants of smoking behavior change, cognitive and emo-
tional constructs (perceived confidence, perceived disease
severity, perceived benefits of quitting and lung screening,
and worry) and knowledge of smoking risks did not
change",NA,NA,NA,NA,NA,NA,NA,NA,NA,NA,NA,NA,NA,NA,"1 year",NA,NA,NA,NA,"laypeople",NA,NA,NA,NA,"current or former smokers",NA,NA,NA,NA,"adults",NA,NA,NA,NA,"usa",NA,NA,NA,NA,430,NA,NA,NA,NA,0.44,NA,NA,NA,NA,"61.05",NA,NA,NA,NA,4.82,NA,NA,NA,NA,55,NA,NA,NA,NA,74,NA,NA,NA,NA
"8","Wuthrich","Comparison of the Penn State Worry Questionnaire (PSWQ) and abbreviated version (PSWQ-A) in a clinical and non-clinical population of older adults",2014,"the aim of this study was to assess the utility of the pswq-a compared to the full pswq, to identify pathological worry in an older adult sample (n = 108) of clinically anxious and depressed older adults,
compared to a non-clinical sample (n = 53).",NA,"longitudinal","worry",NA,NA,NA,NA,"scale",NA,NA,NA,NA,"5-point likert scale",NA,NA,NA,NA,"8 items",NA,NA,NA,NA,"2",NA,NA,NA,NA,"single",NA,NA,NA,NA,NA,NA,NA,NA,NA,NA,NA,NA,NA,NA,NA,NA,NA,NA,NA,NA,NA,NA,NA,NA,"health; other: questionnaire validation","yes",NA,NA,NA,NA,"test-retest",NA,NA,NA,NA,"r=0.70  
0.74",NA,NA,NA,NA,NA,NA,NA,NA,NA,NA,NA,NA,NA,NA,NA,NA,NA,NA,NA,"12 weeks",NA,NA,NA,NA,NA,NA,NA,NA,NA,NA,NA,NA,NA,NA,"laypeople",NA,NA,NA,NA,"clinical sample",NA,NA,NA,NA,"older adults",NA,NA,NA,NA,"australia",NA,NA,NA,NA,22,NA,NA,NA,NA,0.826,NA,NA,NA,NA,NA,NA,NA,NA,NA,NA,NA,NA,NA,NA,NA,NA,NA,NA,NA,NA,NA,NA,NA,NA
"9","Barcenilla-Wong","Concern and Risk Perception: Effects on Osteoprotective Behaviour",2014,"this study aimed to determine the effect that level of concern for osteoporosis, as well as self-perceived risk of osteoporosis and fracture, has on supplementation use, seeking medical advice, bone mineral density (bmd) testing, and antiosteoporosis medication (aom) use.",NA,"longitudinal","risk","concern",NA,NA,NA,"scale","questionnaire",NA,NA,NA,"5-point likert","3-point likert scale (i.e., very concerned, a little concerned, or not at all concerned)",NA,NA,NA,"perception of risk of getting osteoporosis (how would you rate your own risk of “getting osteoporosis” compared to other women your age?) and having a fracture (how would you rate your own risk of fracturing or breaking a bone compared to other women your age?) were both assessed by asking
participants to rate their own risk of getting osteoporosis and also their own risk of having a fracture",NA,NA,NA,NA,"4",4,NA,NA,NA,"single","single",NA,NA,NA,NA,NA,NA,NA,NA,NA,NA,NA,NA,NA,NA,NA,NA,NA,NA,NA,NA,NA,NA,NA,"health","no","no",NA,NA,NA,NA,NA,NA,NA,NA,NA,NA,NA,NA,NA,NA,NA,NA,NA,NA,NA,NA,NA,NA,NA,NA,NA,NA,NA,NA,NA,NA,NA,NA,NA,NA,NA,NA,NA,NA,NA,NA,NA,NA,NA,NA,NA,NA,NA,NA,NA,NA,NA,NA,NA,NA,NA,NA,NA,NA,NA,NA,NA,NA,NA,NA,NA,NA,NA,NA,NA,NA,NA,NA,NA,NA,NA,NA,NA,NA,NA,NA,NA,NA,NA,NA,NA,NA,NA,NA,NA,NA,NA,NA,NA
"10","Carere","The impact of direct-to-consumer personal genomic testing on perceived risk of breast, prostate, colorectal, and lung cancer: findings from the PGen study",2015,"we measured the impact of direct-to-consumer genomic risk information on changes to perceived risk (δpr) of breast, prostate, colorectal and lung cancer among personal genomic testing (pgt) customers.",NA,"longitudinal","risk",NA,NA,NA,NA,"scale",NA,NA,NA,NA,"5-point likert scale",NA,NA,NA,NA,NA,NA,NA,NA,NA,"3",NA,NA,NA,NA,"single",NA,NA,NA,NA,"personal genomic testing",NA,NA,NA,NA,NA,NA,NA,NA,NA,NA,NA,NA,NA,NA,NA,NA,NA,NA,NA,"cancer","yes",NA,NA,NA,NA,"temporal trend",NA,NA,NA,NA,NA,NA,NA,NA,NA,"significant",NA,NA,NA,NA,NA,NA,NA,NA,NA,"all",NA,NA,NA,NA,NA,NA,NA,NA,NA,"6 months",NA,NA,NA,NA,NA,NA,NA,NA,NA,"laypeople",NA,NA,NA,NA,NA,NA,NA,NA,NA,"adults",NA,NA,NA,NA,"united states of america",NA,NA,NA,NA,3160,NA,NA,NA,NA,NA,NA,NA,NA,NA,NA,NA,NA,NA,NA,NA,NA,NA,NA,NA,19,NA,NA,NA,NA,94,NA,NA,NA,NA
"11","Mukerji","Educational and Psychological Issues Predictors of low diabetes risk perception in a multi-ethnic cohort of women with gestational diabetes mellitus",2016,"to determine what proportion of women with gestational diabetes underestimate their diabetes risk and identify factors associated with low diabetes risk perception.",NA,"longitudinal","risk",NA,NA,NA,NA,"single item",NA,NA,NA,NA,"4-point likert scale",NA,NA,NA,NA,"‘what do you think your
chance of getting diabetes over the next 10 years is?",NA,NA,NA,NA,"3",NA,NA,NA,NA,"single",NA,NA,NA,NA,NA,NA,NA,NA,NA,NA,NA,NA,NA,NA,"pregnancy",NA,NA,NA,NA,NA,NA,NA,NA,NA,"health; other: diabetes","no",NA,NA,NA,NA,NA,NA,NA,NA,NA,NA,NA,NA,NA,NA,NA,NA,NA,NA,NA,NA,NA,NA,NA,NA,NA,NA,NA,NA,NA,NA,NA,NA,NA,NA,NA,NA,NA,NA,NA,NA,NA,NA,NA,NA,NA,NA,NA,NA,NA,NA,NA,NA,NA,NA,NA,NA,NA,NA,NA,NA,NA,NA,NA,NA,NA,NA,NA,NA,NA,NA,NA,NA,NA,NA,NA,NA,NA,NA,NA,NA,NA,NA,NA,NA,NA,NA,NA,NA,NA,NA,NA,NA,NA,NA
"12","McKelvey","Adolescent Cigarette Smoking Perceptions and Behavior: Tobacco Control Gains and Gaps Amidst the Rapidly Expanding Tobacco Products Market From 2001 to 2015",2017,"the aim of the study was to determine whether adolescents’ intentions to smoke, cigarette smoking behavior, and specific perceptions of cigarette smoking are different in 2015 versus 2001.",NA,"serial-cross sectional","risk",NA,NA,NA,NA,"scale",NA,NA,NA,NA,"0% - 100%",NA,NA,NA,NA,"participants read the following text: whether or not
you have used any of these products, imagine that you just began
using cigarettes. you use it about 2 to 3 times a day, every day.
sometimes you use it alone and sometimes you use it with friends. if
you use cigarettes 2 to 3 times each day, what is the chance that.
followed by several social and health short-term and long-term
risks and benefits",NA,NA,NA,NA,"2",NA,NA,NA,NA,"single",NA,NA,NA,NA,NA,NA,NA,NA,NA,NA,NA,NA,NA,NA,NA,NA,NA,NA,NA,NA,NA,NA,NA,NA,"cigarettes ; health","yes",NA,NA,NA,NA,"mean difference",NA,NA,NA,NA,NA,NA,NA,NA,NA,NA,NA,NA,NA,NA,"significant",NA,NA,NA,NA,"t1-t2, social risks, long-term health risks (lung cancer and heart attack) were significant",NA,NA,NA,NA,NA,NA,NA,NA,NA,NA,NA,NA,NA,NA,"14 years",NA,NA,NA,NA,"laypeople",NA,NA,NA,NA,NA,NA,NA,NA,NA,"adolescents",NA,NA,NA,NA,"usa",NA,NA,NA,NA,282,NA,NA,NA,NA,0.6,NA,NA,NA,NA,"14.1",NA,NA,NA,NA,1.6,NA,NA,NA,NA,NA,NA,NA,NA,NA,NA,NA,NA,NA,NA
"13","Stuijfzand","Young children have social worries too:  validation of a brief parent report measure of social worries in children aged 4–8 years",2017,"this study investigated the psychometric properties of the social worries anxiety index for young children (swaiy), adapted from the social worries questionnaire—parent version (swq-p; spence, 1995), as a measure of social anxiety in young children.",NA,"longitudinal","worry",NA,NA,NA,NA,"scale",NA,NA,NA,NA,"3-point likert scale",NA,NA,NA,NA,"parents are asked how much his or her child avoids or worries about particular social situations. for example “he or she avoids or gets worried about going to parties”.  total score is computed by summing
all responses (min = 0, max = 20). higher scores indicate more social worries.",NA,NA,NA,NA,"2",NA,NA,NA,NA,"single",NA,NA,NA,NA,NA,NA,NA,NA,NA,NA,NA,NA,NA,NA,NA,NA,NA,NA,NA,NA,NA,NA,NA,NA,"other: social anxiety","yes",NA,NA,NA,NA,"test-retest",NA,NA,NA,NA,"r= 0.87",NA,NA,NA,NA,NA,NA,NA,NA,NA,NA,NA,NA,NA,NA,NA,NA,NA,NA,NA,"2 weeks",NA,NA,NA,NA,NA,NA,NA,NA,NA,NA,NA,NA,NA,NA,"laypeople",NA,NA,NA,NA,NA,NA,NA,NA,NA,"children",NA,NA,NA,NA,"united kingdom",NA,NA,NA,NA,106,NA,NA,NA,NA,0.991,NA,NA,NA,NA,"6.25",NA,NA,NA,NA,1.29,NA,NA,NA,NA,3.92,NA,NA,NA,NA,8.92,NA,NA,NA,NA
"14","Baucum","The Dynamics of Risk Perception for Soft Target Terrorism",2018,"the purpose of this investigation was to examine how individuals’ risk perceptions regarding soft-target terrorism formed over time, as a function of 1) highly publicized terror attacks, and 2) cognitive, affective, and behavior facets of risk perception.","panel data from united states and canada","longitudinal","risk",NA,NA,NA,NA,"scale",NA,NA,NA,NA,"5- point scale: very low risk, low risk, moderate risk, high risk, very high risk",NA,NA,NA,NA,"2 question",NA,NA,NA,NA,"6",NA,NA,NA,NA,"single",NA,NA,NA,NA,NA,NA,NA,NA,NA,NA,NA,NA,NA,NA,"terror attacks",NA,NA,NA,NA,4,NA,NA,NA,NA,"other: terrorism","yes",NA,NA,NA,NA,"temporal trend",NA,NA,NA,NA,NA,NA,NA,NA,NA,"not significant",NA,NA,NA,NA,NA,NA,NA,NA,NA,"β=0.334",NA,NA,NA,NA,NA,NA,NA,NA,NA,"1 month",NA,NA,NA,NA,NA,NA,NA,NA,NA,"laypeople",NA,NA,NA,NA,NA,NA,NA,NA,NA,"adults",NA,NA,NA,NA,"the united states and canada",NA,NA,NA,NA,496,NA,NA,NA,NA,0.64,NA,NA,NA,NA,NA,NA,NA,NA,NA,NA,NA,NA,NA,NA,NA,NA,NA,NA,NA,NA,NA,NA,NA,NA
"15","Schaefer","Accuracy of HIV Risk Perception in East Zimbabwe 2003–2013",2018,"we investigate the degree to which hiv risk perception is accurate, i.e. corresponds to actual hiv infection risks, in a general-population open-cohort study in zimbabwe (2003–2013) including 7201 individuals over 31,326 person-years.","http://www.manicalandhivproject.org/data.html","longitudinal","risk",NA,NA,NA,NA,"single item",NA,NA,NA,NA,"yes, no, don't know",NA,NA,NA,NA,"“do you think you could become infected with hiv yourself in the future?”",NA,NA,NA,NA,"6",NA,NA,NA,NA,"single",NA,NA,NA,NA,NA,NA,NA,NA,NA,NA,NA,NA,NA,NA,NA,NA,NA,NA,NA,NA,NA,NA,NA,NA,"health; other: hiv","yes",NA,NA,NA,NA,"temporal trend",NA,NA,NA,NA,NA,NA,NA,NA,NA,"significant",NA,NA,NA,NA,NA,NA,NA,NA,NA,"among males (n = 3553), 13.0% (95% confidence interval [ci] = 11.9–14.1%) perceived 
a risk of hiv infection, and 47.5% (46.4–48.7%) among 
females (n =7221), with declines over time observed for 
both sexes",NA,NA,NA,NA,NA,NA,NA,NA,NA,"10 years",NA,NA,NA,NA,NA,NA,NA,NA,NA,"laypeople",NA,NA,NA,NA,NA,NA,NA,NA,NA,"adults",NA,NA,NA,NA,"zimbabwe",NA,NA,NA,NA,7201,NA,NA,NA,NA,0.67,NA,NA,NA,NA,NA,NA,NA,NA,NA,NA,NA,NA,NA,NA,NA,NA,NA,NA,NA,NA,NA,NA,NA,NA
"16","Calderón-Larrañaga","Psychological correlates of multimorbidity and disability accumulation in older adults",2019,"we aimed to explore whether different psychological factors were associated with the rate of chronic disease and disability accumulation over time.",NA,"longitudinal","worry",NA,NA,NA,NA,"scale",NA,NA,NA,NA,NA,NA,NA,NA,NA,"our of the six original perceptual subscales of the questionnaire are assessed in snac-k health outlook (i.e. perceptions of future health), resistance to illness (i.e. sense of susceptibility or resistance to illness), sickness orientation (i.e. tendency to accept sickness as a part of life) and health worry (i.e. amount of health-related worry or concern).",NA,NA,NA,NA,"4",NA,NA,NA,NA,"single",NA,NA,NA,NA,NA,NA,NA,NA,NA,NA,NA,NA,NA,NA,NA,NA,NA,NA,NA,NA,NA,NA,NA,NA,"health","no",NA,NA,NA,NA,NA,NA,NA,NA,NA,NA,NA,NA,NA,NA,NA,NA,NA,NA,NA,NA,NA,NA,NA,NA,NA,NA,NA,NA,NA,NA,NA,NA,NA,NA,NA,NA,NA,NA,NA,NA,NA,NA,NA,NA,NA,NA,NA,NA,NA,NA,NA,NA,NA,NA,NA,NA,NA,NA,NA,NA,NA,NA,NA,NA,NA,NA,NA,NA,NA,NA,NA,NA,NA,NA,NA,NA,NA,NA,NA,NA,NA,NA,NA,NA,NA,NA,NA,NA,NA,NA,NA,NA,NA,NA
