"56","Gerber","Taking Care of Each Other: How Can We Increase Compliance with Personal Protective Measures During the COVID-19  Pandemic in Chile?",2021,"in this article, we test the effect of (1) sociodemographic and socioeconomic, (2) instrumental, and (3) normative factors on chilean citizens’ adherence to individual protective measures during the covid-19 pandemic.",NA,"longitudinal","risk","risk",NA,NA,NA,"single item","single item",NA,NA,NA,"5-point likert scale","5-point likert scale",NA,NA,NA,"perceived risk of covid-19 was captured through the question ‘how dangerous do you think coronavirus is for you and your closest ones?’","perceived risk of covid-19 was captured through the question ‘how dangerous do you think coronavirus is for you and your closest ones?’",NA,NA,NA,"5",5,NA,NA,NA,"study 1","study 2",NA,NA,NA,NA,NA,NA,NA,NA,NA,NA,NA,NA,NA,"covid-19","covid-19",NA,NA,NA,NA,NA,NA,NA,NA,"health catastrophe; other: compliance with personal protection","no","no",NA,NA,NA,NA,NA,NA,NA,NA,NA,NA,NA,NA,NA,NA,NA,NA,NA,NA,NA,NA,NA,NA,NA,NA,NA,NA,NA,NA,NA,NA,NA,NA,NA,NA,NA,NA,NA,NA,NA,NA,NA,NA,NA,NA,NA,NA,NA,NA,NA,NA,NA,NA,NA,NA,NA,NA,NA,NA,NA,NA,NA,NA,NA,NA,NA,NA,NA,NA,NA,NA,NA,NA,NA,NA,NA,NA,NA,NA,NA,NA,NA,NA,NA,NA,NA,NA,NA,NA,NA,NA,NA,NA,NA
"57","Wirz","A Longitudinal Analysis of Americans’ Media Sources, Risk Perceptions, and Judged Need for Action during the Zika Outbreak",2021,"the objective of this study is to better understand the effects of media attention on americans’ perceptions of risk by analyzing the different media sources and outlets, or “repertoires,” reported as used during the small 2016–2017 zika outbreak in the u.s.","decision research online panel","longitudinal","risk",NA,NA,NA,NA,NA,NA,NA,NA,NA,NA,NA,NA,NA,NA,"risk perceptions of the zika outbreak (personal risk, u.s. risk, judged need for action) were collected",NA,NA,NA,NA,"4",NA,NA,NA,NA,"single",NA,NA,NA,NA,NA,NA,NA,NA,NA,NA,NA,NA,NA,NA,"zika",NA,NA,NA,NA,NA,NA,NA,NA,NA,"health catastrophe; other: zika","yes",NA,NA,NA,NA,"temporal trend",NA,NA,NA,NA,NA,NA,NA,NA,NA,"significant",NA,NA,NA,NA,NA,NA,NA,NA,NA,"statistically negative trend over time",NA,NA,NA,NA,NA,NA,NA,NA,NA,"82 days",NA,NA,NA,NA,NA,NA,NA,NA,NA,"laypeople",NA,NA,NA,NA,NA,NA,NA,NA,NA,"adults",NA,NA,NA,NA,"united states of america",NA,NA,NA,NA,743,NA,NA,NA,NA,NA,NA,NA,NA,NA,NA,NA,NA,NA,NA,NA,NA,NA,NA,NA,NA,NA,NA,NA,NA,NA,NA,NA,NA,NA
"58","Gidycz","Reciprocal Relationships Among Alcohol Use, Risk Perception, and Sexual Victimization: A Prospective Analysis",2007,"the purpose in this study was to assess longitudinally the relationships among alcohol use, risk perception, and sexual victimization",NA,"longitudinal","risk",NA,NA,NA,NA,"question",NA,NA,NA,NA,"3-point likert",NA,NA,NA,NA,"we asked participants to estimate the likelihood that they would be sexually assaulted during the next academic quarter (approximately 2 months)",NA,NA,NA,NA,"3",NA,NA,NA,NA,"single",NA,NA,NA,NA,NA,NA,NA,NA,NA,NA,NA,NA,NA,NA,NA,NA,NA,NA,NA,NA,NA,NA,NA,NA,"health; other: alcohol, sexual victimization","no",NA,NA,NA,NA,NA,NA,NA,NA,NA,NA,NA,NA,NA,NA,NA,NA,NA,NA,NA,NA,NA,NA,NA,NA,NA,NA,NA,NA,NA,NA,NA,NA,NA,NA,NA,NA,NA,NA,NA,NA,NA,NA,NA,NA,NA,NA,NA,NA,NA,NA,NA,NA,NA,NA,NA,NA,NA,NA,NA,NA,NA,NA,NA,NA,NA,NA,NA,NA,NA,NA,NA,NA,NA,NA,NA,NA,NA,NA,NA,NA,NA,NA,NA,NA,NA,NA,NA,NA,NA,NA,NA,NA,NA,NA
"59","Martin","Dementia Worry and the Perception of Personal Risk",2021,"the present study explores the change sensitivity of the two constructs of worry and risk perception, and how the two constructs are differentially associated with objective risk factors such as family history of dementia.",NA,"longitudinal","risk","worry",NA,NA,NA,"single item","scale",NA,NA,NA,"5-point likert scale","5-point likert scale",NA,NA,NA,"to assess the subjective probability of developing
dementia in the future (“in your opinion, how likely is it that
you will develop dementia one day?”)","5 items: how concerned
are you about developing dementia one day?” (werner,
2002), (2) “i am worried about my memory.” (werner,
2002), (3) “are you afraid of dementia related to yourself?”
(dak-gesundheit, 2018), (4) “the thought of being affected
by dementia is threatening.” (kofahl et al., 2013), and one
new item (5) “how much does the thought of developing
dementia occupy your thoughts currently?",NA,NA,NA,"2",2,NA,NA,NA,"single","single",NA,NA,NA,NA,NA,NA,NA,NA,NA,NA,NA,NA,NA,NA,NA,NA,NA,NA,NA,NA,NA,NA,NA,"health; other: dementia","yes","yes",NA,NA,NA,"correlation","correlation",NA,NA,NA,"0.56","0.69",NA,NA,NA,NA,NA,NA,NA,NA,NA,NA,NA,NA,NA,"t1-t2","t1-t2",NA,NA,NA,"23.9 months","23.9 months",NA,NA,NA,NA,NA,NA,NA,NA,NA,NA,NA,NA,NA,"laypeople","laypeople",NA,NA,NA,NA,NA,NA,NA,NA,"adults","adults",NA,NA,NA,"germany","germany",NA,NA,NA,129,129,NA,NA,NA,0.79,0.79,NA,NA,NA,"39",39,NA,NA,NA,15.6,15.6,NA,NA,NA,21,21,NA,NA,NA,79,79,NA,NA,NA
"60","Wang","The Changing Acceptance of COVID-19 Vaccination in Different Epidemic Phases in China: A Longitudinal Study",2021,"the present study aimed to examine whether the acceptance of covid-19 vaccination changed in different covid-19 epidemic phases in china.","data available upon request","longitudinal","risk",NA,NA,NA,NA,"questionnaire",NA,NA,NA,NA,"5-point likert scale",NA,NA,NA,NA,"questionnaire had items on perceived risk of being infected personally with covid-19",NA,NA,NA,NA,"2",NA,NA,NA,NA,"single",NA,NA,NA,NA,NA,NA,NA,NA,NA,NA,NA,NA,NA,NA,"covid-19",NA,NA,NA,NA,NA,NA,NA,NA,NA,"health; other: coivd-19, vaccination","no",NA,NA,NA,NA,NA,NA,NA,NA,NA,NA,NA,NA,NA,NA,NA,NA,NA,NA,NA,NA,NA,NA,NA,NA,NA,NA,NA,NA,NA,NA,NA,NA,NA,NA,NA,NA,NA,NA,NA,NA,NA,NA,NA,NA,NA,NA,NA,NA,NA,NA,NA,NA,NA,NA,NA,NA,NA,NA,NA,NA,NA,NA,NA,NA,NA,NA,NA,NA,NA,NA,NA,NA,NA,NA,NA,NA,NA,NA,NA,NA,NA,NA,NA,NA,NA,NA,NA,NA,NA,NA,NA,NA,NA,NA
"61","Nowak","Reciprocal relationships among influenza experiences, perceptions, and behavior: Results from a national, longitudinal survey of United States adults",2022,"our objective was to model the reciprocal relationships of perceived risk of contracting influenza with and without influenza vaccination, vaccination behavior, and reported influenza illness","rand american life panel (alp)","longitudinal","risk",NA,NA,NA,NA,"single item",NA,NA,NA,NA,"0% -100%",NA,NA,NA,NA,"assessing an individual’s perceived probability of getting influenza with 
and without vaccination, which changed slightly over the course of the 
study.",NA,NA,NA,NA,"5",NA,NA,NA,NA,"single",NA,NA,NA,NA,NA,NA,NA,NA,NA,NA,NA,NA,NA,NA,NA,NA,NA,NA,NA,NA,NA,NA,NA,NA,"health catastrophe; other: influenza","no",NA,NA,NA,NA,NA,NA,NA,NA,NA,NA,NA,NA,NA,NA,NA,NA,NA,NA,NA,NA,NA,NA,NA,NA,NA,NA,NA,NA,NA,NA,NA,NA,NA,NA,NA,NA,NA,NA,NA,NA,NA,NA,NA,NA,NA,NA,NA,NA,NA,NA,NA,NA,NA,NA,NA,NA,NA,NA,NA,NA,NA,NA,NA,NA,NA,NA,NA,NA,NA,NA,NA,NA,NA,NA,NA,NA,NA,NA,NA,NA,NA,NA,NA,NA,NA,NA,NA,NA,NA,NA,NA,NA,NA,NA
"62","White","A longitudinal perspective on women's risk perceptions for sexual assault",2001,"the present paper examines several questions about fear of stranger and acquaintance assault, the relationship between perceived vulnerability to assault and risk-taking behaviors, and the impact of perceived vulnerability on the likelihood of a future assault.",NA,"longitudinal","risk",NA,NA,NA,NA,"scale",NA,NA,NA,NA,NA,NA,NA,NA,NA,"2 items. 
risk perception was assessed by 
asking respondents to rate their ""chances that the following will happen to 
you at some point in the future"" for the items ""sexual assault by an 
acquaintance/date"" and ""sexual assault by a stranger."" these items were 
embedded in a list of 12 other events",NA,NA,NA,NA,"5",NA,NA,NA,NA,"single",NA,NA,NA,NA,NA,NA,NA,NA,NA,NA,NA,NA,NA,NA,NA,NA,NA,NA,NA,NA,NA,NA,NA,NA,"other: sexual assault","yes",NA,NA,NA,NA,"temporal trend",NA,NA,NA,NA,NA,NA,NA,NA,NA,"significant",NA,NA,NA,NA,NA,NA,NA,NA,NA,"the perceived risk of assault declined significantly across time",NA,NA,NA,NA,NA,NA,NA,NA,NA,"4 years",NA,NA,NA,NA,NA,NA,NA,NA,NA,"laypeople",NA,NA,NA,NA,"female students",NA,NA,NA,NA,"adults",NA,NA,NA,NA,"usa",NA,NA,NA,NA,1569,NA,NA,NA,NA,1,NA,NA,NA,NA,"18.3",NA,NA,NA,NA,NA,NA,NA,NA,NA,18,NA,NA,NA,NA,20,NA,NA,NA,NA
"63","Eggers","Predicting Primary and Secondary Abstinence Among Adolescent Boys and Girls in the Western Cape, South Africa",2017,"this study identified socio-cognitive determinants of
primary and secondary abstinence intentions and of early sexual activity. this study also assessed whether these factors had a direct or indirect association with intentions to abstain from sex.",NA,"longitudinal","risk",NA,NA,NA,NA,"scale",NA,NA,NA,NA,"5-point likert",NA,NA,NA,NA,"risk perceptions towards getting sti’s and hiv were
assessed by four items pertaining to susceptibility and severity.",NA,NA,NA,NA,"2",NA,NA,NA,NA,"single",NA,NA,NA,NA,"promote sexual and reproductive health",NA,NA,NA,NA,NA,NA,NA,NA,NA,NA,NA,NA,NA,NA,NA,NA,NA,NA,NA,"health","yes",NA,NA,NA,NA,"correlation",NA,NA,NA,NA,"male: .49
female: .43",NA,NA,NA,NA,NA,NA,NA,NA,NA,NA,NA,NA,NA,NA,NA,NA,NA,NA,NA,"6 months",NA,NA,NA,NA,NA,NA,NA,NA,NA,NA,NA,NA,NA,NA,"laypeople",NA,NA,NA,NA,"students",NA,NA,NA,NA,"adolescents",NA,NA,NA,NA,"south africa",NA,NA,NA,NA,1670,NA,NA,NA,NA,0.61,NA,NA,NA,NA,"13.6",NA,NA,NA,NA,1.01,NA,NA,NA,NA,12,NA,NA,NA,NA,16,NA,NA,NA,NA
"64","Bacenilla-Wong","Concern and risk perception of osteoporosis and fracture among post-menopausal Australian women: results from the Global Longitudinal Study of Osteoporosis in Women (GLOW) cohort",2013,"the purpose of this study is to identify factors associated with concern and perception of risks of osteoporosis and osteoporotic fractures and determine whether bone mineral density (bmd) testing influenced concern and risk perception.",NA,"longitudinal","risk","concern",NA,NA,NA,"scale","questionnaire",NA,NA,NA,"5-point likert",NA,NA,NA,NA,"perception of risk of getting osteoporosis and having a fracture were both assessed by asking participants to rate their own risk of getting osteo-
porosis and also their own risk of having a fracture (i.e. a lot lower, a little lower, about the same, a little higher or much higher compared to other women their age).","concern about osteoporosis’ was assessed by asking participants to rate their level of concern about osteoporosis (i.e. very concerned, a little concerned or not at all concerned)",NA,NA,NA,"4",4,NA,NA,NA,"single","single",NA,NA,NA,NA,NA,NA,NA,NA,NA,NA,NA,NA,NA,NA,NA,NA,NA,NA,NA,NA,NA,NA,NA,"health","no","no",NA,NA,NA,NA,NA,NA,NA,NA,NA,NA,NA,NA,NA,NA,NA,NA,NA,NA,NA,NA,NA,NA,NA,NA,NA,NA,NA,NA,NA,NA,NA,NA,NA,NA,NA,NA,NA,NA,NA,NA,NA,NA,NA,NA,NA,NA,NA,NA,NA,NA,NA,NA,NA,NA,NA,NA,NA,NA,NA,NA,NA,NA,NA,NA,NA,NA,NA,NA,NA,NA,NA,NA,NA,NA,NA,NA,NA,NA,NA,NA,NA,NA,NA,NA,NA,NA,NA,NA,NA,NA,NA,NA,NA
"65","Poulus","Longitudinal analysis of stressors, stress, coping and coping effectiveness in elite esports athletes",2022,"the current study aimed to longitudinally examine the stressors, stress appraisal, coping, and coping effectiveness experienced by elite esports athletes.",NA,"longitudinal","threat",NA,NA,NA,NA,"single item",NA,NA,NA,NA,"5-point likert scale",NA,NA,NA,NA,"threat (i perceive this stressor as being potentially harmful or causing loss)",NA,NA,NA,NA,"3",NA,NA,NA,NA,"single",NA,NA,NA,NA,NA,NA,NA,NA,NA,NA,NA,NA,NA,NA,NA,NA,NA,NA,NA,NA,NA,NA,NA,NA,"health; other: stress and coping in esports","no",NA,NA,NA,NA,NA,NA,NA,NA,NA,NA,NA,NA,NA,NA,NA,NA,NA,NA,NA,NA,NA,NA,NA,NA,NA,NA,NA,NA,NA,NA,NA,NA,NA,NA,NA,NA,NA,NA,NA,NA,NA,NA,NA,NA,NA,NA,NA,NA,NA,NA,NA,NA,NA,NA,NA,NA,NA,NA,NA,NA,NA,NA,NA,NA,NA,NA,NA,NA,NA,NA,NA,NA,NA,NA,NA,NA,NA,NA,NA,NA,NA,NA,NA,NA,NA,NA,NA,NA,NA,NA,NA,NA,NA,NA
"66","Gong","Threats of COVID-19 arouse public awareness of climate change risks",2022,"(1) confirming the causal relationship between covid-19 and climate change risk perception (i.e., the ‘‘arousal’’ effect) with longitudinal panel data from a large-scale
survey, and (2) examining the hypothesized affective and cognitive pathways as the potential mechanisms.","data available upon request","longitudinal","risk","risk",NA,NA,NA,"scale","scale",NA,NA,NA,"7-point likert scale","7-point likert scale",NA,NA,NA,"covid-19 risk perception: self-reported severity,
perceived others’ severity perception, and perceived strength of the risk’s impact.","climate change risk perception: self-reported severity,
perceived others’ severity perception, and perceived strength of the risk’s impact.",NA,NA,NA,"2",2,NA,NA,NA,"single","single",NA,NA,NA,NA,NA,NA,NA,NA,NA,NA,NA,NA,NA,"covid-19","covid-19",NA,NA,NA,NA,NA,NA,NA,NA,"health catastrophe; natural catastrophe; other: climate change","yes","yes",NA,NA,NA,"correlation","mean difference",NA,NA,NA,"covid: .49
climate: .31",NA,NA,NA,NA,NA,NA,NA,NA,NA,NA,"significant",NA,NA,NA,NA,"increased t1-t2",NA,NA,NA,"1 month",NA,NA,NA,NA,NA,NA,NA,NA,NA,NA,"1 month",NA,NA,NA,"laypeople","laypeople",NA,NA,NA,NA,NA,NA,NA,NA,NA,"adults",NA,NA,NA,"china","china",NA,NA,NA,1266,1266,NA,NA,NA,0.5,0.5,NA,NA,NA,NA,NA,NA,NA,NA,NA,NA,NA,NA,NA,29,29,NA,NA,NA,NA,NA,NA,NA,NA
"67","Smith","Parental monitoring for type 1 diabetes in genetically at-risk young children: The TEDDY study",2021,"we examined parental diabetes monitoring behaviors in a cohort of children at increased genetic risk for type 1 diabetes. we hypothesized that being informed of a positive islet autoantibody (ia) would increase monitoring behaviors",NA,"longitudinal","risk",NA,NA,NA,NA,"scale",NA,NA,NA,NA,"the responses were coded as accurate or an underestimate",NA,NA,NA,NA,"parents were asked about their perception of their child's risk for developing type 1 diabetes at the 6-month visit, the 15-month visit, and annually thereafter. their responses were coded as accurate (the
child's diabetes risk was higher or much higher than other children's
risk) or an underestimate (the child's diabetes risk was the same,
somewhat lower, or much lower than other children's risk)",NA,NA,NA,NA,"3",NA,NA,NA,NA,"single",NA,NA,NA,NA,"diabetes 1 testing",NA,NA,NA,NA,"1",NA,NA,NA,NA,NA,NA,NA,NA,NA,NA,NA,NA,NA,NA,"health; other: diabetes","no",NA,NA,NA,NA,NA,NA,NA,NA,NA,NA,NA,NA,NA,NA,NA,NA,NA,NA,NA,NA,NA,NA,NA,NA,NA,NA,NA,NA,NA,NA,NA,NA,NA,NA,NA,NA,NA,NA,NA,NA,NA,NA,NA,NA,NA,NA,NA,NA,NA,NA,NA,NA,NA,NA,NA,NA,NA,NA,NA,NA,NA,NA,NA,NA,NA,NA,NA,NA,NA,NA,NA,NA,NA,NA,NA,NA,NA,NA,NA,NA,NA,NA,NA,NA,NA,NA,NA,NA,NA,NA,NA,NA,NA,NA
"68","de Graaff","Governance and risk in everyday life: depoliticization and citizens' experiences of cell site deployment in the Netherlands and Southern California",2019,"to map changes in citizens’ experiences of technological risks and asks if these are influenced by risk governance","dutch national level panel","serial-cross sectional","risk",NA,NA,NA,NA,"single item",NA,NA,NA,NA,"5-point likert",NA,NA,NA,NA,"our risk perception question was: ‘how worried are you about the health effects of cell towers?’",NA,NA,NA,NA,"4",NA,NA,NA,NA,"single",NA,NA,NA,NA,NA,NA,NA,NA,NA,NA,NA,NA,NA,NA,NA,NA,NA,NA,NA,NA,NA,NA,NA,NA,"other: technological (cell site deployment)","no",NA,NA,NA,NA,NA,NA,NA,NA,NA,NA,NA,NA,NA,NA,NA,NA,NA,NA,NA,NA,NA,NA,NA,NA,NA,NA,NA,NA,NA,NA,NA,NA,NA,NA,NA,NA,NA,NA,NA,NA,NA,NA,NA,NA,NA,NA,NA,NA,NA,NA,NA,NA,NA,NA,NA,NA,NA,NA,NA,NA,NA,NA,NA,NA,NA,NA,NA,NA,NA,NA,NA,NA,NA,NA,NA,NA,NA,NA,NA,NA,NA,NA,NA,NA,NA,NA,NA,NA,NA,NA,NA,NA,NA,NA
"69","Betsch","How baby’s first shot determines the development of maternal attitudes towards vaccination",2018,"this study aimed to assess how and why attitudes become more pro-vaccine or vaccine-skeptical over time, and which sources are especially influential in this process.","https://osf.io/chk97","longitudinal","risk","concern",NA,NA,NA,"scale","questionnaire",NA,NA,NA,"0 (no risk) to 100 (very high risk)","0 (no concern) to 100 (very high concern)",NA,NA,NA,"perceived risk of vaccine-adverse events and of vaccine-preventable disease","concerns about vaccine-adverse events and about vaccine-preventable disease",NA,NA,NA,"4",4,NA,NA,NA,"single","single",NA,NA,NA,NA,NA,NA,NA,NA,NA,NA,NA,NA,NA,"vaccination/pregnancy","vaccination/pregnancy",NA,NA,NA,3,3,NA,NA,NA,"health; other: pregnancy","yes","yes",NA,NA,NA,"mean difference","mean difference",NA,NA,NA,NA,NA,NA,NA,NA,NA,NA,NA,NA,NA,"significant","significant",NA,NA,NA,"t0 - follow- up 1 (+3months)
t0 - follow- up 2 (+6months)
t0 - follow- up 3(+14months)
follow up 1 (+3months) - follow- up 3(+14months)","t0 - follow- up 1 (+3months)
t0 - follow- up 3(+14months)
",NA,NA,NA,NA,NA,NA,NA,NA,NA,NA,NA,NA,NA,"7.5 months","7.5 months",NA,NA,NA,"laypeople","laypeople",NA,NA,NA,"mothers","mothers",NA,NA,NA,"adults","adults",NA,NA,NA,"germany","germany",NA,NA,NA,351,351,NA,NA,NA,1,1,NA,NA,NA,NA,NA,NA,NA,NA,NA,NA,NA,NA,NA,18,18,NA,NA,NA,49,49,NA,NA,NA
"70","Köteles","Modern Health Worries, Somatosensory Amplification and Subjective Symptoms: A Longitudinal Study",2013,"the study investigates the temporal association among subjective symptoms, somatosensory amplification (ssa), and modern health worries (mhws).",NA,"longitudinal","worry",NA,NA,NA,NA,"scale",NA,NA,NA,NA,"5-point likert scale",NA,NA,NA,NA,"25 items. modern health worries. the scale is divided into four sub scales (environmental pollution, toxic interventions, tainted food, radiation)",NA,NA,NA,NA,"2",NA,NA,NA,NA,"single",NA,NA,NA,NA,NA,NA,NA,NA,NA,NA,NA,NA,NA,NA,NA,NA,NA,NA,NA,NA,NA,NA,NA,NA,"health; natural catastrophe; nuclear power accidents ; other: environmental pollution, toxic interventions, tainted food, radiation","yes",NA,NA,NA,NA,"correlation",NA,NA,NA,NA,"r=0.74",NA,NA,NA,NA,NA,NA,NA,NA,NA,NA,NA,NA,NA,NA,NA,NA,NA,NA,NA,"2 months",NA,NA,NA,NA,NA,NA,NA,NA,NA,NA,NA,NA,NA,NA,NA,NA,NA,NA,NA,NA,NA,NA,NA,NA,NA,NA,NA,NA,NA,NA,NA,NA,NA,NA,NA,NA,NA,NA,NA,NA,NA,NA,NA,NA,NA,NA,NA,NA,NA,NA,NA,NA,NA,NA,NA,NA,NA,NA,NA,NA,NA,NA,NA,NA
"71","Bearth","Reactions of older Swiss adults to the COVID-19 pandemic: A longitudinal  survey on the acceptance of and adherence to public health measures",2021,"to improve public health communication, it is vital to understand, which sociodemographic and psychological factors drive older people’s acceptance of and compliance with public health measures.",NA,"serial-cross sectional","risk",NA,NA,NA,NA,"scale",NA,NA,NA,NA,"7-point likert",NA,NA,NA,NA,"personal risk perception was measured with three single items related 
to a) likelihood of infection, b) vulnerability to infection and c) severity 
of illness",NA,NA,NA,NA,"3",NA,NA,NA,NA,"single",NA,NA,NA,NA,NA,NA,NA,NA,NA,NA,NA,NA,NA,NA,"covid-19",NA,NA,NA,NA,NA,NA,NA,NA,NA,"health catastrophe","yes",NA,NA,NA,NA,"mean difference",NA,NA,NA,NA,NA,NA,NA,NA,NA,NA,NA,NA,NA,NA,"significant",NA,NA,NA,NA,"likelihood of infection and vulnerability to infection: wave 1 -wave 2 (increased)
wave 2 -wave 3 (remained stable)",NA,NA,NA,NA,NA,NA,NA,NA,NA,"1 month",NA,NA,NA,NA,NA,NA,NA,NA,NA,"laypeople",NA,NA,NA,NA,NA,NA,NA,NA,NA,"older adults",NA,NA,NA,NA,"switzerland",NA,NA,NA,NA,327,NA,NA,NA,NA,0.31,NA,NA,NA,NA,"70",NA,NA,NA,NA,7,NA,NA,NA,NA,59,NA,NA,NA,NA,90,NA,NA,NA,NA
"72","Liao","Trajectories of public psycho-behavioural responses relating to influenza A(H7N9) over the winter of 2014-15 in Hong Kong",2019,"to explore trajectories of public psycho-behavioural
responses over one influenza a(h7n9) epidemic wave, and examine the interplays among social norm influence, disease worry and protective behaviours",NA,"longitudinal","worry",NA,NA,NA,NA,"scale",NA,NA,NA,NA,"5-point categorical scale",NA,NA,NA,NA,"worry about h7n9: participants were asked to rate their level of worry about personal and family/relatives being infected with h7n9, respectively, on a five-point categorical scale. internal consistency was desirable with cronbach’s a ranging between 0.71 and 0.79 over the five phases.",NA,NA,NA,NA,"5",NA,NA,NA,NA,"single",NA,NA,NA,NA,NA,NA,NA,NA,NA,NA,NA,NA,NA,NA,NA,NA,NA,NA,NA,NA,NA,NA,NA,NA,"health catastrophe; other: influenza a (h7n9)","no",NA,NA,NA,NA,NA,NA,NA,NA,NA,NA,NA,NA,NA,NA,NA,NA,NA,NA,NA,NA,NA,NA,NA,NA,NA,NA,NA,NA,NA,NA,NA,NA,NA,NA,NA,NA,NA,NA,NA,NA,NA,NA,NA,NA,NA,NA,NA,NA,NA,NA,NA,NA,NA,NA,NA,NA,NA,NA,NA,NA,NA,NA,NA,NA,NA,NA,NA,NA,NA,NA,NA,NA,NA,NA,NA,NA,NA,NA,NA,NA,NA,NA,NA,NA,NA,NA,NA,NA,NA,NA,NA,NA,NA,NA
"73","Osório","Monitoring the Mental Health and Professional Overload of Health Workers in Brazil: A Longitudinal Study Considering the First Wave of the COVID-19 Pandemic",2022,"the objective was to assess the evolution of mental health indicators of brazilian health workers providing care to covid-19 patients, considering the beginning and first wave of the pandemic, identifying risk and protective factors.","data available upon request","longitudinal","concern",NA,NA,NA,NA,"scale",NA,NA,NA,NA,"2-point likert scale (yes, no)",NA,NA,NA,NA,"concerns with being infected; concerns with a family member being infected",NA,NA,NA,NA,"7",NA,NA,NA,NA,"single",NA,NA,NA,NA,NA,NA,NA,NA,NA,NA,NA,NA,NA,NA,"covid-19",NA,NA,NA,NA,NA,NA,NA,NA,NA,"health; other: mental health and professional overload of health workers","no",NA,NA,NA,NA,NA,NA,NA,NA,NA,NA,NA,NA,NA,NA,NA,NA,NA,NA,NA,NA,NA,NA,NA,NA,NA,NA,NA,NA,NA,NA,NA,NA,NA,NA,NA,NA,NA,NA,NA,NA,NA,NA,NA,NA,NA,NA,NA,NA,NA,NA,NA,NA,NA,NA,NA,NA,NA,NA,NA,NA,NA,NA,NA,NA,NA,NA,NA,NA,NA,NA,NA,NA,NA,NA,NA,NA,NA,NA,NA,NA,NA,NA,NA,NA,NA,NA,NA,NA,NA,NA,NA,NA,NA,NA
"74","Kent","The relationship between perceived risk, thought intrusiveness and emotional well-being in women receiving counselling for breast cancer risk in a family history clinic",2000,"this study was designed to assess changes in perceived risk, cognitive intrusions and distress in women undergoing counselling for familial risk of developing breast cancer.",NA,"longitudinal","risk","risk","risk",NA,NA,"scale","scale","scale",NA,NA,"10 cm visual analogue scale (vas), ranging from ‘not at all likely’ to ‘virtually inevitable’","10 cm visual analogue scale (vas), ranging from ‘not at all likely’ to ‘virtually inevitable’","10 cm visual analogue scale (vas), ranging from ‘not at all likely’ to ‘virtually inevitable’",NA,NA,"in order to assess perceived risk, the women were asked to indicate the extent to which they believed that they would develop breast cancer sometime in their lives","in order to assess perceived risk, the women were asked to indicate the extent to which they believed that they would develop breast cancer sometime in their lives","in order to assess perceived risk, the women were asked to indicate the extent to which they believed that they would develop breast cancer sometime in their lives",NA,NA,"3",3,3,NA,NA,"single","single","single",NA,NA,"counselling. following referral, women were visited at home by a trained nurse specialist. a family pedigree was constructed, specific anxieties were identified and an outline of the
forthcoming clinic visit was provided.","counselling. following referral, women were visited at home by a trained nurse specialist. a family pedigree was constructed, specific anxieties were identified and an outline of the
forthcoming clinic visit was provided.","counselling. following referral, women were visited at home by a trained nurse specialist. a family pedigree was constructed, specific anxieties were identified and an outline of the
forthcoming clinic visit was provided.",NA,NA,"1",1,1,NA,NA,NA,NA,NA,NA,NA,NA,NA,NA,NA,NA,"cancer ; other: breast cancer","yes","yes","yes",NA,NA,"correlation","correlation","correlation",NA,NA,"r=0.71","r=0.73","r=0.79",NA,NA,NA,NA,NA,NA,NA,NA,NA,NA,NA,NA,"t1-t2","t1-t3","t2-t3",NA,NA,"3 months","6 months","3 months",NA,NA,NA,NA,NA,NA,NA,NA,NA,NA,NA,NA,"laypeople","laypeople","laypeople",NA,NA,NA,NA,NA,NA,NA,"adults","adults","adults",NA,NA,NA,"uk","uk",NA,NA,49,49,49,NA,NA,1,1,1,NA,NA,"36.8",36.8,36.8,NA,NA,7.3,7.3,7.3,NA,NA,23,23,23,NA,NA,63,63,63,NA,NA
"75","Vornanen","Diabetes and Cardiovascular Disease Risk Perception and Risk Indicators: a 5-Year Follow-up",2021,"we examined in a 5-year follow-up, whether perceived risks of diabetes and cardiovascular disease predicted physical activity, body mass index (bmi kg/m2), and blood glucose level, or the reverse. we examined further whether perceived risk, self-efficacy, and outcome beliefs
together predicted changes in these risk indicators.",NA,"longitudinal","risk",NA,NA,NA,NA,"single item",NA,NA,NA,NA,"5-point likert scale",NA,NA,NA,NA,"perceived absolute lifetime risk of diabetes was measured at
baseline and at follow-up, before health examinations, with
a single item: how do you evaluate your own risk of getting
diabetes in your lifetime? 0 = i have diabetes, 1 = very low, 2
= low, 3 = moderate, 4 = high, 5 = very high.",NA,NA,NA,NA,"2",NA,NA,NA,NA,"single",NA,NA,NA,NA,"health examination",NA,NA,NA,NA,"1",NA,NA,NA,NA,NA,NA,NA,NA,NA,NA,NA,NA,NA,NA,"health; other: diabetes","yes",NA,NA,NA,NA,"correlation",NA,NA,NA,NA,"r=0.58",NA,NA,NA,NA,NA,NA,NA,NA,NA,NA,NA,NA,NA,NA,"significant",NA,NA,NA,NA,"5 years",NA,NA,NA,NA,NA,NA,NA,NA,NA,NA,NA,NA,NA,NA,"laypeople",NA,NA,NA,NA,NA,NA,NA,NA,NA,"adults",NA,NA,NA,NA,"finland",NA,NA,NA,NA,909,NA,NA,NA,NA,0.577,NA,NA,NA,NA,"55.9",NA,NA,NA,NA,6.9,NA,NA,NA,NA,45,NA,NA,NA,NA,74,NA,NA,NA,NA
