"117","McComas","Public Meetings and Risk Amplification: A Longitudinal Study",2003,"this study seeks to offer insight into the potential influence of attending public meetings on two specific variables: (1) perceptions of risk associated with a local hazard and (2) belief in the credibility of those managing the risk (i.e., state government agencies and local industry responsible for hazard).",NA,"longitudinal","risk",NA,NA,NA,NA,"scale",NA,NA,NA,NA,"7-point likert scale",NA,NA,NA,NA,"7 items
(1) they had a choice over exposure to the risks from the landfill or waste site, (2) they could control their exposure to the risks, (3) the risks were increasing, (4) the risks posed threats to future generations, (5) they could reduce their exposure to the risks, (6) the risks were the kind that people dread, and (7) they were personally threatened by the risk. while these seven questions did not capture the risk perception model in its entirety, the usefulness of these questions in relation to a single, ongoing risk controversy has been
shown.",NA,NA,NA,NA,"3",NA,NA,NA,NA,"single",NA,NA,NA,NA,NA,NA,NA,NA,NA,NA,NA,NA,NA,NA,NA,NA,NA,NA,NA,NA,NA,NA,NA,NA,"other: hazardous waste site","yes",NA,NA,NA,NA,"mean difference",NA,NA,NA,NA,NA,NA,NA,NA,NA,NA,NA,NA,NA,NA,"not significant",NA,NA,NA,NA,NA,NA,NA,NA,NA,NA,NA,NA,NA,NA,NA,NA,NA,NA,NA,"1 year 8 months",NA,NA,NA,NA,"experts",NA,NA,NA,NA,"attendees and nonattendees of public meetings",NA,NA,NA,NA,"adults",NA,NA,NA,NA,"belgium",NA,NA,NA,NA,212,NA,NA,NA,NA,NA,NA,NA,NA,NA,NA,NA,NA,NA,NA,NA,NA,NA,NA,NA,NA,NA,NA,NA,NA,NA,NA,NA,NA,NA
"118","Kim","US adult smokers’ perceived relative risk on ENDS and its effects on their transitions between cigarettes and ENDS",2022,"this research examines us smokers’ relative risk perceptions and their prospective association with various behavioral stages of switching to ends.","population assessment of tobacco and health (path) data (cohort study, unsure if this identifies as panel???)","longitudinal","risk",NA,NA,NA,NA,"single item",NA,NA,NA,NA,"3-point likert scale, less harmful,” “about the same,” 
or “more harmful.”",NA,NA,NA,NA,"“is using 
e-cigarettes less harmful, about the same, or more harm-
ful than smoking cigarettes?”",NA,NA,NA,NA,"5",NA,NA,NA,NA,"single",NA,NA,NA,NA,NA,NA,NA,NA,NA,NA,NA,NA,NA,NA,NA,NA,NA,NA,NA,NA,NA,NA,NA,NA,"cigarettes ; other: electronic nicotine delivery systems","yes",NA,NA,NA,NA,"temporal trend",NA,NA,NA,NA,NA,NA,NA,NA,NA,NA,NA,NA,NA,NA,NA,NA,NA,NA,NA,"the proportion of us smokers perceiving ends as less harmful than cigarettes continually decreased, 
reaching 17.4% in wave 5 (2019).",NA,NA,NA,NA,NA,NA,NA,NA,NA,"13 months",NA,NA,NA,NA,NA,NA,NA,NA,NA,"laypeople",NA,NA,NA,NA,"smokers",NA,NA,NA,NA,"adults",NA,NA,NA,NA,"united states of america",NA,NA,NA,NA,NA,NA,NA,NA,NA,NA,NA,NA,NA,NA,NA,NA,NA,NA,NA,NA,NA,NA,NA,NA,18,NA,NA,NA,NA,NA,NA,NA,NA,NA
"119","Seebauer","(Almost) all Quiet Over One and a Half Years: A
Longitudinal Study on Causality Between Key Determinants of Private Flood Mitigation",2021,"examining intrahousehold change over time and assessing the temporal precedence of cause over effect. using a longitudinal design to produce more clarity about the causal paths within the pmt (private flood mitigation).",NA,"longitudinal","risk",NA,NA,NA,NA,"scale",NA,NA,NA,NA,"10-point likert scale",NA,NA,NA,NA,"cognitive risk appraisal is measured by perceived probability and damage of a severe flood within the next 10 years at the respondent’s own building. risk perception for the entire municipality also assessed.",NA,NA,NA,NA,"2",NA,NA,NA,NA,"single",NA,NA,NA,NA,NA,NA,NA,NA,NA,NA,NA,NA,NA,NA,NA,NA,NA,NA,NA,NA,NA,NA,NA,NA,"natural catastrophe; other: floods","yes",NA,NA,NA,NA,"mean difference",NA,NA,NA,NA,NA,NA,NA,NA,NA,NA,NA,NA,NA,NA,"not significant",NA,NA,NA,NA,NA,NA,NA,NA,NA,NA,NA,NA,NA,NA,NA,NA,NA,NA,NA,"1 year 8 months",NA,NA,NA,NA,"laypeople",NA,NA,NA,NA,NA,NA,NA,NA,NA,"adults",NA,NA,NA,NA,"austria",NA,NA,NA,NA,554,NA,NA,NA,NA,NA,NA,NA,NA,NA,NA,NA,NA,NA,NA,NA,NA,NA,NA,NA,NA,NA,NA,NA,NA,NA,NA,NA,NA,NA
"120","de Vet","Predictors of Stage Transitions in the Precaution
Adoption Process Model",2008,"to explore psychosocial correlates and predictors of stage transitions in the precaution adoption process model (papm) for fruit intake.","dutch internet research panel","longitudinal","risk",NA,NA,NA,NA,"scale",NA,NA,NA,NA,"5-point likert",NA,NA,NA,NA,"4 items",NA,NA,NA,NA,"3",NA,NA,NA,NA,"single",NA,NA,NA,NA,NA,NA,NA,NA,NA,NA,NA,NA,NA,NA,NA,NA,NA,NA,NA,NA,NA,NA,NA,NA,"health","no",NA,NA,NA,NA,NA,NA,NA,NA,NA,NA,NA,NA,NA,NA,NA,NA,NA,NA,NA,NA,NA,NA,NA,NA,NA,NA,NA,NA,NA,NA,NA,NA,NA,NA,NA,NA,NA,NA,NA,NA,NA,NA,NA,NA,NA,NA,NA,NA,NA,NA,NA,NA,NA,NA,NA,NA,NA,NA,NA,NA,NA,NA,NA,NA,NA,NA,NA,NA,NA,NA,NA,NA,NA,NA,NA,NA,NA,NA,NA,NA,NA,NA,NA,NA,NA,NA,NA,NA,NA,NA,NA,NA,NA,NA
"121","Xu","People at Risk of Influenza Pandemics: The Evolution of Perception and Behavior",2015,"our study aimed to understand the dynamics of public perception and behavior over the course of the 2009 h1n1 influenza pandemic.",NA,"serial-cross sectional","risk",NA,NA,NA,NA,"scale",NA,NA,NA,NA,"5-point likert scale",NA,NA,NA,NA,"6 items. 
among the six questions, three were about the risk of contracting the disease to self, immediate family members, and the community, and three were about the risk of there being difficulties once influenza permeated the community.",NA,NA,NA,NA,"3",NA,NA,NA,NA,"single",NA,NA,NA,NA,NA,NA,NA,NA,NA,NA,NA,NA,NA,NA,"h1n1 influenza pandemic",NA,NA,NA,NA,NA,NA,NA,NA,NA,"health catastrophe; other: h1n1 influenza pandemic","yes",NA,NA,NA,NA,"temporal trend",NA,NA,NA,NA,NA,NA,NA,NA,NA,"significant",NA,NA,NA,NA,NA,NA,NA,NA,NA,"perceived risk increased over the course of the h1n1 influenza pandemic",NA,NA,NA,NA,NA,NA,NA,NA,NA,"6.5 months",NA,NA,NA,NA,NA,NA,NA,NA,NA,"laypeople",NA,NA,NA,NA,NA,NA,NA,NA,NA,"adults",NA,NA,NA,NA,"china",NA,NA,NA,NA,1006,NA,NA,NA,NA,0.48,NA,NA,NA,NA,NA,NA,NA,NA,NA,NA,NA,NA,NA,NA,NA,NA,NA,NA,NA,NA,NA,NA,NA,NA
"122","Schmid","Reducing Aggressive Intergroup Action Tendencies: Effects of Intergroup Contact Via Perceived Intergroup Threat",2014,"we examine the relationship between intergroup contact and intergroup aggressive action tendencies (studies 1 and 2) and intergroup attitudes
(study 2), and seek to explain the nature of these relationships by taking account of a key intervening psychological variable: perceived intergroup threat.",NA,"serial-cross sectional","threat",NA,NA,NA,NA,"scale",NA,NA,NA,NA,"5-point likert scale",NA,NA,NA,NA,"2 items.
perceived intergroup threat was assessed using four
items. respondents were asked to indicate their
agreement, using five‐point scales (1 ¼ strongly dis-
agree, 5 ¼ strongly agree), with the following items
(stephan & renfro, 2002): “the more power
<outgroup> gain in this country, the more difficult
it is for <ingroup>,” “allowing <outgroup> to
decide on political issues means that <ingroup> have
less say in how this country is run,” “<outgroup>
have been trying to get ahead economically, at the
expense of <ingroup>,” and “more good jobs for
<outgroup> means fewer good jobs for
<ingroup>.”",NA,NA,NA,NA,"2",NA,NA,NA,NA,"study 2",NA,NA,NA,NA,NA,NA,NA,NA,NA,NA,NA,NA,NA,NA,NA,NA,NA,NA,NA,NA,NA,NA,NA,NA,"other: aggressive intergroup action","yes",NA,NA,NA,NA,"correlation",NA,NA,NA,NA,"r=0.42",NA,NA,NA,NA,NA,NA,NA,NA,NA,NA,NA,NA,NA,NA,"t1-t2",NA,NA,NA,NA,"1 year",NA,NA,NA,NA,NA,NA,NA,NA,NA,NA,NA,NA,NA,NA,"laypeople",NA,NA,NA,NA,"participants with an immigrant background",NA,NA,NA,NA,"adults",NA,NA,NA,NA,"germany, italy, netherlands, poland, uk, portugal, france, hungary",NA,NA,NA,NA,7042,NA,NA,NA,NA,0.53,NA,NA,NA,NA,"49.36",NA,NA,NA,NA,16.98,NA,NA,NA,NA,16,NA,NA,NA,NA,98,NA,NA,NA,NA
"123","Canetti","Threatened or Threatening? How Ideology Shapes Asylum Seekers’ Immigration Policy Attitudes in Israel and Australia",2016,"we examine the role of political ideology (political position or political preference) and threat perception as predictors of different levels of support for exclusionary asylum policies","midgam panel","longitudinal","threat",NA,NA,NA,NA,"scale",NA,NA,NA,NA,"7-point likert",NA,NA,NA,NA,"two subscales containing four realistic threat item",NA,NA,NA,NA,"2",NA,NA,NA,NA,"study 2",NA,NA,NA,NA,NA,NA,NA,NA,NA,NA,NA,NA,NA,NA,"conflict in august 2014 known in
israel as operation protective edge",NA,NA,NA,NA,NA,NA,NA,NA,NA,"other: political","no",NA,NA,NA,NA,NA,NA,NA,NA,NA,NA,NA,NA,NA,NA,NA,NA,NA,NA,NA,NA,NA,NA,NA,NA,NA,NA,NA,NA,NA,NA,NA,NA,NA,NA,NA,NA,NA,NA,NA,NA,NA,NA,NA,NA,NA,NA,NA,NA,NA,NA,NA,NA,NA,NA,NA,NA,NA,NA,NA,NA,NA,NA,NA,NA,NA,NA,NA,NA,NA,NA,NA,NA,NA,NA,NA,NA,NA,NA,NA,NA,NA,NA,NA,NA,NA,NA,NA,NA,NA,NA,NA,NA,NA,NA
"124","Johnson","Longitudinal effects of cigarette pictorial warning labels 
among young adults",2022,"the current study seeks to examine the longitudinal effects of pictorial warnings among young adults",NA,"longitudinal","risk",NA,NA,NA,NA,"scale",NA,NA,NA,NA,"5-point likert scale",NA,NA,NA,NA,"four items: deliberative and affective risk perceptions, each with two items. ""how much do you think your health has been harmed by smoking?"", ""how concerned are you that your smoking has affected your health?""",NA,NA,NA,NA,"4",NA,NA,NA,NA,"single",NA,NA,NA,NA,"randomized into one of five conditions: 1. gain-framed branded pack, 2. loss-framed branded pack, 3.grain-framed plain pack, 4. loss-framed plain pack, 5. control pack. those randomized to one of the first four conditions were then ran-
domized to receive pictorial warnings communicating the risks of (1) cancer, (2) lung disease, (3) heart disease/stroke, or (4) mortality informed by prior work",NA,NA,NA,NA,"1",NA,NA,NA,NA,NA,NA,NA,NA,NA,NA,NA,NA,NA,NA,"cigarettes ; health","yes",NA,NA,NA,NA,"mean difference",NA,NA,NA,NA,NA,NA,NA,NA,NA,NA,NA,NA,NA,NA,"not significant",NA,NA,NA,NA,"baseline to post-intervention",NA,NA,NA,NA,NA,NA,NA,NA,NA,"2 months",NA,NA,NA,NA,NA,NA,NA,NA,NA,"laypeople",NA,NA,NA,NA,NA,NA,NA,NA,NA,"young adults",NA,NA,NA,NA,"usa",NA,NA,NA,NA,229,NA,NA,NA,NA,0.445,NA,NA,NA,NA,"24.6",NA,NA,NA,NA,3.4,NA,NA,NA,NA,18,NA,NA,NA,NA,30,NA,NA,NA,NA
"125","Imai","Risk perception, self-efficacy, trust for physician, depression, and behavior modification in diabetic patients",2020,"the aim of this study is to evaluate the effects of risk perception, self-efficacy, and trust on different health promotion behaviors as well as on depressive mood of diabetic patients.",NA,"longitudinal","risk",NA,NA,NA,NA,"scale",NA,NA,NA,NA,"5-point likert",NA,NA,NA,NA,"a total of two items were used for the evaluation of risk perception (total score: 2–10): “feeling scared when you think about living with diabetes?” and “worrying about the future and the possibility of serious complications?” higher scores indicated higher risk perception.",NA,NA,NA,NA,"2",NA,NA,NA,NA,"single",NA,NA,NA,NA,"participants 
in the intervention arm received consultation 
reminders and consultation recommendations 
in case of no consultation, care guidance, con-
sultation with computer-aided treatment goal 
setting, weight scale, and a pedometer, if they 
wished.",NA,NA,NA,NA,"1",NA,NA,NA,NA,NA,NA,NA,NA,NA,NA,NA,NA,NA,NA,"health; other: behavioral changes in diabetic patients","no",NA,NA,NA,NA,NA,NA,NA,NA,NA,NA,NA,NA,NA,NA,NA,NA,NA,NA,NA,NA,NA,NA,NA,NA,NA,NA,NA,NA,NA,NA,NA,NA,NA,NA,NA,NA,NA,NA,NA,NA,NA,NA,NA,NA,NA,NA,NA,NA,NA,NA,NA,NA,NA,NA,NA,NA,NA,NA,NA,NA,NA,NA,NA,NA,NA,NA,NA,NA,NA,NA,NA,NA,NA,NA,NA,NA,NA,NA,NA,NA,NA,NA,NA,NA,NA,NA,NA,NA,NA,NA,NA,NA,NA,NA
"126","Armstrong-Carter","Adolescents' perceptions of social risk and prosocial tendencies: Developmental change and individual differences",2023,"the goals of the present study were to investigate: (1) do adolescents report more prosocial tendencies during years when they report more or less social risk tolerance? (2) does the link between prosocial tendencies and social risk tolerance change across early- to mid-adolescence? (3) does the link between prosocial tendencies and social risk tolerance vary according to individual differences in sensation seeking and empathy?","data available upon request","longitudinal","risk",NA,NA,NA,NA,"scale",NA,NA,NA,NA,"7-point likert-type scale ranging from ""not at all risky"" to ""extremely risky""",NA,NA,NA,NA,"we created a mean score at each time point, and reverse scored the measure, such that higher scores indicate the adolescent felt relatively more tolerant of social risks (i.e., less averse or concerned about taking risks), and lower scores indicate the adolescent felt relatively more averse to social risks (i.e., more concerned about taking risks).",NA,NA,NA,NA,"3",NA,NA,NA,NA,"single",NA,NA,NA,NA,NA,NA,NA,NA,NA,NA,NA,NA,NA,NA,NA,NA,NA,NA,NA,NA,NA,NA,NA,NA,"other: social risk and prosocial tendencies","no",NA,NA,NA,NA,NA,NA,NA,NA,NA,NA,NA,NA,NA,NA,NA,NA,NA,NA,NA,NA,NA,NA,NA,NA,NA,NA,NA,NA,NA,NA,NA,NA,NA,NA,NA,NA,NA,NA,NA,NA,NA,NA,NA,NA,NA,NA,NA,NA,NA,NA,NA,NA,NA,NA,NA,NA,NA,NA,NA,NA,NA,NA,NA,NA,NA,NA,NA,NA,NA,NA,NA,NA,NA,NA,NA,NA,NA,NA,NA,NA,NA,NA,NA,NA,NA,NA,NA,NA,NA,NA,NA,NA,NA,NA
"127","Gordon","Resistance exercise training among young adults with analogue generalized anxiety disorder",2021,"the objective of this randomized controlled trial (rct) was to quantify the effects of eight weeks of world health organization and american college of sports medicine guidelines-based resistance exercise  training (ret) among participants meeting criteria for subclinical, or analogue-gad (agad)",NA,"longitudinal","worry",NA,NA,NA,NA,"scale",NA,NA,NA,NA,"5-point likert scale",NA,NA,NA,NA,"16-item penn state worry questionnaire. secondary outcome dependent variables included worry, worry- engagement, and absence of worry assessed with the 16-item pswq. total worry, worry-engagement, and absence of worry scores were calculated according to recommendations",NA,NA,NA,NA,"4",NA,NA,NA,NA,"single",NA,NA,NA,NA,"resistance exercise training. the eight-week, twice-weekly intervention increased resistance progressively, such that the participant could complete between 8-12 repetitions before experiencing either fatigue, a deterioration in lifting form, or failure to complete a repetition. the eight exercises were barbell squat, barbell bench press, hexagon bar deadlift, seated dumbbell shoulder lateral raise, barbell bent over rows, dumbbell lunges, seated dumbbell curls, and abdominal crunches.",NA,NA,NA,NA,"1",NA,NA,NA,NA,NA,NA,NA,NA,NA,NA,NA,NA,NA,NA,"health; other: exercise and anxiety disorder","yes",NA,NA,NA,NA,"correlation",NA,NA,NA,NA,"hedges's d
b-w1: 0.69 (-0.09 to 1.47) 
w1-w4: 0.02 (-0.74 to 0.78) 
w4-w8: 0.19 (-0.58 to 
0.95)",NA,NA,NA,NA,NA,NA,NA,NA,NA,NA,NA,NA,NA,NA,NA,NA,NA,NA,NA,"3 weeks",NA,NA,NA,NA,NA,NA,NA,NA,NA,NA,NA,NA,NA,NA,"laypeople",NA,NA,NA,NA,"patient",NA,NA,NA,NA,"adults",NA,NA,NA,NA,"ireland",NA,NA,NA,NA,44,NA,NA,NA,NA,0.666,NA,NA,NA,NA,"25.4",NA,NA,NA,NA,4.3,NA,NA,NA,NA,NA,NA,NA,NA,NA,NA,NA,NA,NA,NA
"128","Qin","Exploring the dynamic relationships between risk perception and behavior in response to the Coronavirus Disease 2019 (COVID-19) outbreak",2021,"the main objectives of this research are: (1) to assess 
temporal changes in cognitive and affective dimensions of perceived covid-19 risk as well as related protective 
behavior; and (2) to explore the dynamic relationships between covid-19 risk perception and behavioral responses.",NA,"serial-cross sectional","risk",NA,NA,NA,NA,"scale",NA,NA,NA,NA,"5-point likert scale",NA,NA,NA,NA,"3 items. 
key dimensions of perceived covid-19 risk were measured by 
asking respondents to describe their perceived likelihood of infection, 
perceived potential harmfulness if infected, and level of anxiety using a 
5-point ordinal scale ranging from 1 (very unlikely, not at all harmful, or not at all anxious) to 5 (very likely, very harmful, or very anxious).",NA,NA,NA,NA,"3",NA,NA,NA,NA,"single",NA,NA,NA,NA,NA,NA,NA,NA,NA,NA,NA,NA,NA,NA,"covid-19",NA,NA,NA,NA,NA,NA,NA,NA,NA,"health catastrophe; other: covid-19","yes",NA,NA,NA,NA,"temporal trend",NA,NA,NA,NA,NA,NA,NA,NA,NA,"significant",NA,NA,NA,NA,NA,NA,NA,NA,NA,"t1-t2-t3: there were significant changes across the three survey phases of both case studies regarding perceived severity and perceptions of covid-19",NA,NA,NA,NA,NA,NA,NA,NA,NA,"2 months",NA,NA,NA,NA,NA,NA,NA,NA,NA,"laypeople",NA,NA,NA,NA,"sample consisted of two case studies",NA,NA,NA,NA,"adults",NA,NA,NA,NA,"usa",NA,NA,NA,NA,1976,NA,NA,NA,NA,0.5825,NA,NA,NA,NA,"49.85",NA,NA,NA,NA,NA,NA,NA,NA,NA,NA,NA,NA,NA,NA,NA,NA,NA,NA,NA
"129","Siegrist","Worldviews, trust, and risk perceptions shape public
acceptance of COVID-19 public health measures",2021,"we aimed to examine the influence of people’s trust and worldviews on their risk perceptions regarding covid-19 and their acceptance of the implemented measures","https://osf.io/ar6zf","longitudinal","risk",NA,NA,NA,NA,"scale",NA,NA,NA,NA,"7-point likert scale",NA,NA,NA,NA,"5 items for asking about health risk perception and the coronavirus",NA,NA,NA,NA,"2",NA,NA,NA,NA,"single",NA,NA,NA,NA,NA,NA,NA,NA,NA,NA,NA,NA,NA,NA,"covid-19",NA,NA,NA,NA,NA,NA,NA,NA,NA,"health catastrophe","yes",NA,NA,NA,NA,"mean difference",NA,NA,NA,NA,NA,NA,NA,NA,NA,NA,NA,NA,NA,NA,"significant",NA,NA,NA,NA,"t1-t2",NA,NA,NA,NA,NA,NA,NA,NA,NA,NA,NA,NA,NA,NA,"3 weeks",NA,NA,NA,NA,"laypeople",NA,NA,NA,NA,NA,NA,NA,NA,NA,"adults",NA,NA,NA,NA,"switzerland",NA,NA,NA,NA,1223,NA,NA,NA,NA,0.51,NA,NA,NA,NA,NA,NA,NA,NA,NA,NA,NA,NA,NA,NA,20,NA,NA,NA,NA,70,NA,NA,NA,NA
"130","Johnson","Temporal shifts in Americans' risk perceptions of the Zika outbreak",2020,"an earlier longitudinal panel study of americans’ views on ebola risk inspired this partial replication on americans’ views of zika risks, using multilevel modeling to assess temporal changes in these views and inter-individual factors affecting them, and to determine if similar factors were influential for both non-epidemics in the usa.","decision research online panel","longitudinal","risk",NA,NA,NA,NA,"single item",NA,NA,NA,NA,"6-point likert",NA,NA,NA,NA,"judged risk of zika to self and the usa: “how much risk does zika pose to you or your family [the usa]?”",NA,NA,NA,NA,"4",NA,NA,NA,NA,"single",NA,NA,NA,NA,NA,NA,NA,NA,NA,NA,NA,NA,NA,NA,NA,NA,NA,NA,NA,NA,NA,NA,NA,NA,"health catastrophe; other: zika","yes",NA,NA,NA,NA,"temporal trend",NA,NA,NA,NA,NA,NA,NA,NA,NA,"significant",NA,NA,NA,NA,NA,NA,NA,NA,NA,"judged personal risk declined over time, although the low was in survey 3 (during winter, when mosquitoes are absent) with an intermediate value in survey 4, when the mosquito season had begun except in the northernmost tier of the lower 48 states",NA,NA,NA,NA,NA,NA,NA,NA,NA,"90 days",NA,NA,NA,NA,NA,NA,NA,NA,NA,"laypeople",NA,NA,NA,NA,NA,NA,NA,NA,NA,"adults",NA,NA,NA,NA,"usa",NA,NA,NA,NA,370,NA,NA,NA,NA,0.514,NA,NA,NA,NA,"47.3",NA,NA,NA,NA,18.5,NA,NA,NA,NA,NA,NA,NA,NA,NA,NA,NA,NA,NA,NA
"131","Rockliffe","Investigating the utility of the COM-B and TM model to explain changes in eating behaviour during pregnancy: A longitudinal cohort study",2022,"this study aimed to investigate and compare the utility of the capability-opportunity-motivation behaviour (com-b) and teachable moments (tm) models, to explain health behaviour change during pregnancy, within the context of eating behaviour.","data available upon request","longitudinal","risk","worry",NA,NA,NA,"scale","scale",NA,NA,NA,"7-point likert scale","5-point likert scale",NA,NA,NA,"participants were asked to respond to four statements
assessing their level of concern about their health and that of their baby during their pregnancy","participants were asked to respond to two statements
assessing levels of worry about their health and that of their baby during their pregnancy,",NA,NA,NA,"4",4,NA,NA,NA,"single","single",NA,NA,NA,NA,NA,NA,NA,NA,NA,NA,NA,NA,NA,"covid-19","covid-19",NA,NA,NA,NA,NA,NA,NA,NA,"health; other: pregnancy","yes","yes",NA,NA,NA,"mean difference","mean difference",NA,NA,NA,NA,NA,NA,NA,NA,NA,NA,NA,NA,NA,"significant","significant",NA,NA,NA,"participants’ perceived risk towards the health of their baby was significantly higher at t2 than t1","participants’ levels of worry about their health and that of the baby reduced
significantly from t1 to t4  and from t2 to t4",NA,NA,NA,NA,NA,NA,NA,NA,NA,NA,NA,NA,NA,"15.33 weeks","15.33 weeks",NA,NA,NA,"laypeople","laypeople",NA,NA,NA,"pregnant women","pregnant women",NA,NA,NA,"adults","adults",NA,NA,NA,"united kingdom","united kingdom",NA,NA,NA,516,516,NA,NA,NA,1,1,NA,NA,NA,"30",30,NA,NA,NA,4.8,4.8,NA,NA,NA,18,18,NA,NA,NA,45,45,NA,NA,NA
"132","Yilmaz","Psychometric Characteristics of the Penn State Worry 
Questionnaire and Metacognitions Questionnaire-30 and Metacognitive Predictors of Worry and Obsessive–Compulsive Symptoms in a Turkish Sample",2008,"the purpose of the present study was twofold. first, to examine the psychometric properties of the penn state worry questionnaire (pswq) and the metacognitions questionnaire-30 (mcq-30) in a turkish sample. second, to investigate metacognitive predictors of pathological worry and obsessive–compulsive (o–c) symptoms in 
this group.",NA,"longitudinal","worry",NA,NA,NA,NA,"scale",NA,NA,NA,NA,"5-point likert scale",NA,NA,NA,NA,"16 items
penn state worry questionnaire",NA,NA,NA,NA,"2",NA,NA,NA,NA,"single",NA,NA,NA,NA,NA,NA,NA,NA,NA,NA,NA,NA,NA,NA,NA,NA,NA,NA,NA,NA,NA,NA,NA,NA,"health; other: questionnaire validation","yes",NA,NA,NA,NA,"test-retest",NA,NA,NA,NA,"r= 0.88",NA,NA,NA,NA,NA,NA,NA,NA,NA,NA,NA,NA,NA,NA,NA,NA,NA,NA,NA,"6 weeks",NA,NA,NA,NA,NA,NA,NA,NA,NA,NA,NA,NA,NA,NA,"laypeople",NA,NA,NA,NA,"students",NA,NA,NA,NA,"adults",NA,NA,NA,NA,"turkey",NA,NA,NA,NA,26,NA,NA,NA,NA,0.07,NA,NA,NA,NA,"28.39",NA,NA,NA,NA,4.3,NA,NA,NA,NA,23,NA,NA,NA,NA,46,NA,NA,NA,NA
"133","Grabski","Is approving esketamine as an antidepressant for treatment resistant depression associated with recreational use and risk perception of ketamine? Results from a longitudinal and cross-sectional survey in nightlife attendees",2022,"1) whether the risk perception of recreational ketamine use decreased following esketamine’s approval as an antidepressant, 2) whether past 12 month use and frequency of ketamine use changed after esketamine’s approval in a longitudinal sample, 3) attitudes towards medical and recreational ketamine, 4) risk perception of experiences as a result of ketamine use and actual experiences following ketamine use in this nightlife sample.","data from the electronic music scene survey united kingdom (emss uk), an extension of the emss survey","longitudinal","risk",NA,NA,NA,NA,"scale",NA,NA,NA,NA,"5-point likert scale",NA,NA,NA,NA,"participants assessed the risk of 14 potential experiences as a result of
ketamine use",NA,NA,NA,NA,"3",NA,NA,NA,NA,"single",NA,NA,NA,NA,NA,NA,NA,NA,NA,NA,NA,NA,NA,NA,NA,NA,NA,NA,NA,NA,NA,NA,NA,NA,"drugs; other: esketamine for treating depression","no",NA,NA,NA,NA,NA,NA,NA,NA,NA,NA,NA,NA,NA,NA,NA,NA,NA,NA,NA,NA,NA,NA,NA,NA,NA,NA,NA,NA,NA,NA,NA,NA,NA,NA,NA,NA,NA,NA,NA,NA,NA,NA,NA,NA,NA,NA,NA,NA,NA,NA,NA,NA,NA,NA,NA,NA,NA,NA,NA,NA,NA,NA,NA,NA,NA,NA,NA,NA,NA,NA,NA,NA,NA,NA,NA,NA,NA,NA,NA,NA,NA,NA,NA,NA,NA,NA,NA,NA,NA,NA,NA,NA,NA,NA
"134","Wise","Changes in risk perception and self-reported protective
behaviour during the first week of the COVID-19 pandemic in the United States",2020,"the current study, therefore, sought to investigate perceptions of risk and behavioural responses to the pandemic in individuals from the united states during the early stages of the outbreak in march 2020.",NA,"serial-cross sectional","risk",NA,NA,NA,NA,"scale",NA,NA,NA,NA,"visual analogue scale 0-100",NA,NA,NA,NA,"3 items
risk perception questions asked about the perception of risk in
terms of infection likelihood and severity and asked about multiple hypothetical ‘average’ people in
addition to the subject themselves (for example the average person in the neighbourhood, state and
country).",NA,NA,NA,NA,"2",NA,NA,NA,NA,"single",NA,NA,NA,NA,NA,NA,NA,NA,NA,NA,NA,NA,NA,NA,"covid-19",NA,NA,NA,NA,NA,NA,NA,NA,NA,"health catastrophe; other: covid-19","yes",NA,NA,NA,NA,"mean difference",NA,NA,NA,NA,NA,NA,NA,NA,NA,NA,NA,NA,NA,NA,"significant",NA,NA,NA,NA,"t1-t2",NA,NA,NA,NA,NA,NA,NA,NA,NA,NA,NA,NA,NA,NA,"5 days",NA,NA,NA,NA,"laypeople",NA,NA,NA,NA,NA,NA,NA,NA,NA,"adults",NA,NA,NA,NA,"usa",NA,NA,NA,NA,375,NA,NA,NA,NA,0.55,NA,NA,NA,NA,"30",NA,NA,NA,NA,NA,NA,NA,NA,NA,NA,NA,NA,NA,NA,NA,NA,NA,NA,NA
"135","Contreras-Yáñez","Validation of a risk perception questionnaire developed for patients with rheumatoid arthritis",2019,"we developed and validated a risk perception questionnaire for spanish speaking rheumatoid arthritis patients",NA,"serial-cross sectional","risk",NA,NA,NA,NA,"scale",NA,NA,NA,NA,"visual analogue scale (vas), 100-milimeter straight line with verbal description at the endpoints: no likelihood - absolute likelihood",NA,NA,NA,NA,"items: likelihood to develop articular and extra-articular manifestation; likelihood to develop complications and/or comorbidities and disease severity; likelihood to develop socioeconomic unfavorable consequences; perception of personal responsibility to prevent and develop ra-related complications; perception of personal control over the disease",NA,NA,NA,NA,"3",NA,NA,NA,NA,"single",NA,NA,NA,NA,NA,NA,NA,NA,NA,NA,NA,NA,NA,NA,NA,NA,NA,NA,NA,NA,NA,NA,NA,NA,"health; other: rheumatoid arthritis","yes",NA,NA,NA,NA,"test-retest",NA,NA,NA,NA,"icc = 0.93",NA,NA,NA,NA,NA,NA,NA,NA,NA,NA,NA,NA,NA,NA,"significant",NA,NA,NA,NA,"12.9 days",NA,NA,NA,NA,NA,NA,NA,NA,NA,NA,NA,NA,NA,NA,"laypeople",NA,NA,NA,NA,"rheumatoid arthritis outpatients",NA,NA,NA,NA,"adults",NA,NA,NA,NA,"mexico",NA,NA,NA,NA,270,NA,NA,NA,NA,0.97,NA,NA,NA,NA,"57",NA,NA,NA,NA,NA,NA,NA,NA,NA,50,NA,NA,NA,NA,63,NA,NA,NA,NA
